
         /\      Grafana   /‾‾/  
    /\  /  \     |\  __   /  /   
   /  \/    \    | |/ /  /   ‾‾\ 
  /          \   |   (  |  (‾)  |
 / __________ \  |_|\_\  \_____/ 

     execution: local
        script: tests/k6/scenario-baseline.js
        output: -

     scenarios: (100.00%) 1 scenario, 10 max VUs, 1m30s max duration (incl. graceful stop):
              * default: 10 looping VUs for 1m0s (gracefulStop: 30s)

time="2025-12-07T10:48:04Z" level=info msg="🔧 Setting up user pool..." source=console
time="2025-12-07T10:48:04Z" level=info msg="✅ Loaded 50 male users" source=console
time="2025-12-07T10:48:04Z" level=info msg="✅ Loaded 50 female users" source=console

running (0m01.0s), 10/10 VUs, 0 complete and 0 interrupted iterations
default   [   1% ] 10 VUs  0m00.7s/1m0s

running (0m02.0s), 10/10 VUs, 0 complete and 0 interrupted iterations
default   [   3% ] 10 VUs  0m01.7s/1m0s

running (0m03.0s), 10/10 VUs, 8 complete and 0 interrupted iterations
default   [   5% ] 10 VUs  0m02.7s/1m0s

running (0m04.0s), 10/10 VUs, 8 complete and 0 interrupted iterations
default   [   6% ] 10 VUs  0m03.7s/1m0s

running (0m05.0s), 10/10 VUs, 8 complete and 0 interrupted iterations
default   [   8% ] 10 VUs  0m04.7s/1m0s

running (0m06.0s), 10/10 VUs, 8 complete and 0 interrupted iterations
default   [  10% ] 10 VUs  0m05.7s/1m0s

running (0m07.0s), 10/10 VUs, 8 complete and 0 interrupted iterations
default   [  11% ] 10 VUs  0m06.7s/1m0s

running (0m08.0s), 10/10 VUs, 8 complete and 0 interrupted iterations
default   [  13% ] 10 VUs  0m07.7s/1m0s

running (0m09.0s), 10/10 VUs, 17 complete and 0 interrupted iterations
default   [  15% ] 10 VUs  0m08.8s/1m0s

running (0m10.0s), 10/10 VUs, 17 complete and 0 interrupted iterations
default   [  16% ] 10 VUs  0m09.7s/1m0s

running (0m11.0s), 10/10 VUs, 18 complete and 0 interrupted iterations
default   [  18% ] 10 VUs  0m10.7s/1m0s

running (0m12.0s), 10/10 VUs, 18 complete and 0 interrupted iterations
default   [  20% ] 10 VUs  0m11.7s/1m0s

running (0m13.0s), 10/10 VUs, 18 complete and 0 interrupted iterations
default   [  21% ] 10 VUs  0m12.7s/1m0s

running (0m14.0s), 10/10 VUs, 18 complete and 0 interrupted iterations
default   [  23% ] 10 VUs  0m13.7s/1m0s

running (0m15.0s), 10/10 VUs, 18 complete and 0 interrupted iterations
default   [  25% ] 10 VUs  0m14.7s/1m0s

running (0m16.0s), 10/10 VUs, 18 complete and 0 interrupted iterations
default   [  26% ] 10 VUs  0m15.7s/1m0s

running (0m17.0s), 10/10 VUs, 18 complete and 0 interrupted iterations
default   [  28% ] 10 VUs  0m16.7s/1m0s

running (0m18.0s), 10/10 VUs, 18 complete and 0 interrupted iterations
default   [  30% ] 10 VUs  0m17.7s/1m0s

running (0m19.0s), 10/10 VUs, 18 complete and 0 interrupted iterations
default   [  31% ] 10 VUs  0m18.7s/1m0s

running (0m20.0s), 10/10 VUs, 18 complete and 0 interrupted iterations
default   [  33% ] 10 VUs  0m19.7s/1m0s

running (0m21.0s), 10/10 VUs, 19 complete and 0 interrupted iterations
default   [  35% ] 10 VUs  0m20.7s/1m0s

running (0m22.0s), 10/10 VUs, 24 complete and 0 interrupted iterations
default   [  36% ] 10 VUs  0m21.7s/1m0s

running (0m23.0s), 10/10 VUs, 25 complete and 0 interrupted iterations
default   [  38% ] 10 VUs  0m22.7s/1m0s

running (0m24.0s), 10/10 VUs, 25 complete and 0 interrupted iterations
default   [  40% ] 10 VUs  0m23.7s/1m0s

running (0m25.0s), 10/10 VUs, 26 complete and 0 interrupted iterations
default   [  41% ] 10 VUs  0m24.7s/1m0s

running (0m26.0s), 10/10 VUs, 27 complete and 0 interrupted iterations
default   [  43% ] 10 VUs  0m25.7s/1m0s

running (0m27.0s), 10/10 VUs, 28 complete and 0 interrupted iterations
default   [  45% ] 10 VUs  0m26.7s/1m0s

running (0m28.0s), 10/10 VUs, 29 complete and 0 interrupted iterations
default   [  46% ] 10 VUs  0m27.7s/1m0s

running (0m29.0s), 10/10 VUs, 31 complete and 0 interrupted iterations
default   [  48% ] 10 VUs  0m28.7s/1m0s

running (0m30.0s), 10/10 VUs, 32 complete and 0 interrupted iterations
default   [  50% ] 10 VUs  0m29.7s/1m0s

running (0m31.0s), 10/10 VUs, 33 complete and 0 interrupted iterations
default   [  51% ] 10 VUs  0m30.7s/1m0s

running (0m32.0s), 10/10 VUs, 33 complete and 0 interrupted iterations
default   [  53% ] 10 VUs  0m31.7s/1m0s

running (0m33.0s), 10/10 VUs, 34 complete and 0 interrupted iterations
default   [  55% ] 10 VUs  0m32.7s/1m0s

running (0m34.0s), 10/10 VUs, 34 complete and 0 interrupted iterations
default   [  56% ] 10 VUs  0m33.8s/1m0s

running (0m35.0s), 10/10 VUs, 35 complete and 0 interrupted iterations
default   [  58% ] 10 VUs  0m34.7s/1m0s

running (0m36.0s), 10/10 VUs, 36 complete and 0 interrupted iterations
default   [  60% ] 10 VUs  0m35.7s/1m0s

running (0m37.0s), 10/10 VUs, 37 complete and 0 interrupted iterations
default   [  61% ] 10 VUs  0m36.7s/1m0s

running (0m38.0s), 10/10 VUs, 37 complete and 0 interrupted iterations
default   [  63% ] 10 VUs  0m37.7s/1m0s

running (0m39.0s), 10/10 VUs, 38 complete and 0 interrupted iterations
default   [  65% ] 10 VUs  0m38.8s/1m0s

running (0m40.0s), 10/10 VUs, 38 complete and 0 interrupted iterations
default   [  66% ] 10 VUs  0m39.7s/1m0s

running (0m41.0s), 10/10 VUs, 39 complete and 0 interrupted iterations
default   [  68% ] 10 VUs  0m40.7s/1m0s

running (0m42.0s), 10/10 VUs, 40 complete and 0 interrupted iterations
default   [  70% ] 10 VUs  0m41.7s/1m0s

running (0m43.0s), 10/10 VUs, 42 complete and 0 interrupted iterations
default   [  71% ] 10 VUs  0m42.8s/1m0s

running (0m44.0s), 10/10 VUs, 44 complete and 0 interrupted iterations
default   [  73% ] 10 VUs  0m43.7s/1m0s

running (0m45.0s), 10/10 VUs, 45 complete and 0 interrupted iterations
default   [  75% ] 10 VUs  0m44.7s/1m0s

running (0m46.0s), 10/10 VUs, 45 complete and 0 interrupted iterations
default   [  76% ] 10 VUs  0m45.7s/1m0s

running (0m47.0s), 10/10 VUs, 46 complete and 0 interrupted iterations
default   [  78% ] 10 VUs  0m46.7s/1m0s

running (0m48.0s), 10/10 VUs, 48 complete and 0 interrupted iterations
default   [  80% ] 10 VUs  0m47.7s/1m0s

running (0m49.0s), 10/10 VUs, 49 complete and 0 interrupted iterations
default   [  81% ] 10 VUs  0m48.7s/1m0s

running (0m50.0s), 10/10 VUs, 50 complete and 0 interrupted iterations
default   [  83% ] 10 VUs  0m49.7s/1m0s

running (0m51.0s), 10/10 VUs, 50 complete and 0 interrupted iterations
default   [  85% ] 10 VUs  0m50.7s/1m0s

running (0m52.0s), 10/10 VUs, 51 complete and 0 interrupted iterations
default   [  86% ] 10 VUs  0m51.7s/1m0s

running (0m53.0s), 10/10 VUs, 53 complete and 0 interrupted iterations
default   [  88% ] 10 VUs  0m52.7s/1m0s

running (0m54.0s), 10/10 VUs, 54 complete and 0 interrupted iterations
default   [  90% ] 10 VUs  0m53.7s/1m0s

running (0m55.0s), 10/10 VUs, 56 complete and 0 interrupted iterations
default   [  91% ] 10 VUs  0m54.7s/1m0s

running (0m56.0s), 10/10 VUs, 56 complete and 0 interrupted iterations
default   [  93% ] 10 VUs  0m55.7s/1m0s

running (0m57.0s), 10/10 VUs, 57 complete and 0 interrupted iterations
default   [  95% ] 10 VUs  0m56.7s/1m0s

running (0m58.0s), 10/10 VUs, 57 complete and 0 interrupted iterations
default   [  96% ] 10 VUs  0m57.7s/1m0s

running (0m59.0s), 10/10 VUs, 59 complete and 0 interrupted iterations
default   [  98% ] 10 VUs  0m58.8s/1m0s

running (1m00.0s), 10/10 VUs, 60 complete and 0 interrupted iterations
default   [ 100% ] 10 VUs  0m59.7s/1m0s

running (1m01.0s), 09/10 VUs, 62 complete and 0 interrupted iterations
default ↓ [ 100% ] 10 VUs  1m0s

running (1m02.0s), 07/10 VUs, 64 complete and 0 interrupted iterations
default ↓ [ 100% ] 10 VUs  1m0s

running (1m03.0s), 06/10 VUs, 65 complete and 0 interrupted iterations
default ↓ [ 100% ] 10 VUs  1m0s

running (1m04.0s), 05/10 VUs, 66 complete and 0 interrupted iterations
default ↓ [ 100% ] 10 VUs  1m0s

running (1m05.0s), 05/10 VUs, 66 complete and 0 interrupted iterations
default ↓ [ 100% ] 10 VUs  1m0s

running (1m06.0s), 04/10 VUs, 67 complete and 0 interrupted iterations
default ↓ [ 100% ] 10 VUs  1m0s

running (1m07.0s), 04/10 VUs, 67 complete and 0 interrupted iterations
default ↓ [ 100% ] 10 VUs  1m0s

running (1m08.0s), 04/10 VUs, 67 complete and 0 interrupted iterations
default ↓ [ 100% ] 10 VUs  1m0s

running (1m09.0s), 03/10 VUs, 68 complete and 0 interrupted iterations
default ↓ [ 100% ] 10 VUs  1m0s

running (1m10.0s), 03/10 VUs, 68 complete and 0 interrupted iterations
default ↓ [ 100% ] 10 VUs  1m0s

running (1m11.0s), 03/10 VUs, 68 complete and 0 interrupted iterations
default ↓ [ 100% ] 10 VUs  1m0s

running (1m12.0s), 01/10 VUs, 70 complete and 0 interrupted iterations
default ↓ [ 100% ] 10 VUs  1m0s


  █ THRESHOLDS 

    http_req_duration
    ✓ 'p(95)<2000' p(95)=812.5ms

    http_req_failed
    ✓ 'rate<0.05' rate=0.00%

    match_found
    ✓ 'rate>0.3' rate=100.00%

    spin_success
    ✗ 'rate>0.95' rate=88.73%


  █ TOTAL RESULTS 

    checks_total.......: 205    2.814593/s
    checks_succeeded...: 96.09% 197 out of 205
    checks_failed......: 3.90%  8 out of 205

    ✓ spin status is 200
    ✗ spin response time < 1s
      ↳  88% — ✓ 63 / ✗ 8
    ✓ vote status is 200

    CUSTOM
    match_found....................: 100.00% 63 out of 63
    match_time_ms..................: avg=6302.222222 min=1648    med=3488     max=31183  p(90)=13457.8  p(95)=16463.9
    matches_created................: 63      0.864973/s
    spin_success...................: 88.73%  63 out of 71
    spins_initiated................: 63      0.864973/s
    vote_success...................: 100.00% 63 out of 63

    HTTP
    http_req_duration..............: avg=207.69ms    min=59.15ms med=122.34ms max=1.9s   p(90)=297.59ms p(95)=812.5ms
      { expected_response:true }...: avg=207.69ms    min=59.15ms med=122.34ms max=1.9s   p(90)=297.59ms p(95)=812.5ms
    http_req_failed................: 0.00%   0 out of 326
    http_reqs......................: 326     4.47589/s

    EXECUTION
    iteration_duration.............: avg=9.24s       min=1.73s   med=7.39s    max=35.69s p(90)=16.27s   p(95)=20.11s 
    iterations.....................: 71      0.97481/s
    vus............................: 1       min=1        max=10
    vus_max........................: 10      min=10       max=10

    NETWORK
    data_received..................: 150 kB  2.1 kB/s
    data_sent......................: 56 kB   773 B/s




running (1m12.8s), 00/10 VUs, 71 complete and 0 interrupted iterations
default ✓ [ 100% ] 10 VUs  1m0s
time="2025-12-07T10:49:17Z" level=error msg="thresholds on metrics 'spin_success' have been crossed"
