
         /\      Grafana   /‾‾/  
    /\  /  \     |\  __   /  /   
   /  \/    \    | |/ /  /   ‾‾\ 
  /          \   |   (  |  (‾)  |
 / __________ \  |_|\_\  \_____/ 

     execution: local
        script: tests/k6/scenario-baseline.js
        output: -

     scenarios: (100.00%) 1 scenario, 10 max VUs, 1m30s max duration (incl. graceful stop):
              * default: 10 looping VUs for 1m0s (gracefulStop: 30s)

time="2025-12-07T10:50:57Z" level=info msg="🔧 Setting up user pool..." source=console
time="2025-12-07T10:50:58Z" level=info msg="✅ Loaded 50 male users" source=console
time="2025-12-07T10:50:58Z" level=info msg="✅ Loaded 50 female users" source=console

running (0m01.0s), 10/10 VUs, 0 complete and 0 interrupted iterations
default   [   1% ] 10 VUs  0m00.5s/1m0s

running (0m02.0s), 10/10 VUs, 0 complete and 0 interrupted iterations
default   [   3% ] 10 VUs  0m01.5s/1m0s

running (0m03.0s), 10/10 VUs, 0 complete and 0 interrupted iterations
default   [   4% ] 10 VUs  0m02.5s/1m0s

running (0m04.0s), 10/10 VUs, 3 complete and 0 interrupted iterations
default   [   6% ] 10 VUs  0m03.5s/1m0s

running (0m05.0s), 10/10 VUs, 4 complete and 0 interrupted iterations
default   [   8% ] 10 VUs  0m04.5s/1m0s

running (0m06.0s), 10/10 VUs, 7 complete and 0 interrupted iterations
default   [   9% ] 10 VUs  0m05.5s/1m0s

running (0m07.0s), 10/10 VUs, 7 complete and 0 interrupted iterations
default   [  11% ] 10 VUs  0m06.5s/1m0s

running (0m08.0s), 10/10 VUs, 8 complete and 0 interrupted iterations
default   [  13% ] 10 VUs  0m07.5s/1m0s

running (0m09.0s), 10/10 VUs, 10 complete and 0 interrupted iterations
default   [  14% ] 10 VUs  0m08.5s/1m0s

running (0m10.0s), 10/10 VUs, 11 complete and 0 interrupted iterations
default   [  16% ] 10 VUs  0m09.5s/1m0s

running (0m11.0s), 10/10 VUs, 11 complete and 0 interrupted iterations
default   [  18% ] 10 VUs  0m10.5s/1m0s

running (0m12.0s), 10/10 VUs, 14 complete and 0 interrupted iterations
default   [  19% ] 10 VUs  0m11.5s/1m0s

running (0m13.0s), 10/10 VUs, 15 complete and 0 interrupted iterations
default   [  21% ] 10 VUs  0m12.5s/1m0s

running (0m14.0s), 10/10 VUs, 15 complete and 0 interrupted iterations
default   [  23% ] 10 VUs  0m13.5s/1m0s

running (0m15.0s), 10/10 VUs, 16 complete and 0 interrupted iterations
default   [  24% ] 10 VUs  0m14.5s/1m0s

running (0m16.0s), 10/10 VUs, 17 complete and 0 interrupted iterations
default   [  26% ] 10 VUs  0m15.5s/1m0s

running (0m17.0s), 10/10 VUs, 18 complete and 0 interrupted iterations
default   [  28% ] 10 VUs  0m16.5s/1m0s

running (0m18.0s), 10/10 VUs, 18 complete and 0 interrupted iterations
default   [  29% ] 10 VUs  0m17.5s/1m0s

running (0m19.0s), 10/10 VUs, 18 complete and 0 interrupted iterations
default   [  31% ] 10 VUs  0m18.5s/1m0s

running (0m20.0s), 10/10 VUs, 19 complete and 0 interrupted iterations
default   [  33% ] 10 VUs  0m19.5s/1m0s

running (0m21.0s), 10/10 VUs, 19 complete and 0 interrupted iterations
default   [  34% ] 10 VUs  0m20.5s/1m0s

running (0m22.0s), 10/10 VUs, 19 complete and 0 interrupted iterations
default   [  36% ] 10 VUs  0m21.5s/1m0s

running (0m23.0s), 10/10 VUs, 22 complete and 0 interrupted iterations
default   [  38% ] 10 VUs  0m22.5s/1m0s

running (0m24.0s), 10/10 VUs, 23 complete and 0 interrupted iterations
default   [  39% ] 10 VUs  0m23.5s/1m0s

running (0m25.0s), 10/10 VUs, 25 complete and 0 interrupted iterations
default   [  41% ] 10 VUs  0m24.5s/1m0s

running (0m26.0s), 10/10 VUs, 26 complete and 0 interrupted iterations
default   [  43% ] 10 VUs  0m25.5s/1m0s

running (0m27.0s), 10/10 VUs, 26 complete and 0 interrupted iterations
default   [  44% ] 10 VUs  0m26.5s/1m0s

running (0m28.0s), 10/10 VUs, 27 complete and 0 interrupted iterations
default   [  46% ] 10 VUs  0m27.5s/1m0s

running (0m29.0s), 10/10 VUs, 28 complete and 0 interrupted iterations
default   [  48% ] 10 VUs  0m28.5s/1m0s

running (0m30.0s), 10/10 VUs, 28 complete and 0 interrupted iterations
default   [  49% ] 10 VUs  0m29.5s/1m0s

running (0m31.0s), 10/10 VUs, 29 complete and 0 interrupted iterations
default   [  51% ] 10 VUs  0m30.5s/1m0s

running (0m32.0s), 10/10 VUs, 32 complete and 0 interrupted iterations
default   [  53% ] 10 VUs  0m31.5s/1m0s

running (0m33.0s), 10/10 VUs, 33 complete and 0 interrupted iterations
default   [  54% ] 10 VUs  0m32.5s/1m0s

running (0m34.0s), 10/10 VUs, 33 complete and 0 interrupted iterations
default   [  56% ] 10 VUs  0m33.5s/1m0s

running (0m35.0s), 10/10 VUs, 33 complete and 0 interrupted iterations
default   [  58% ] 10 VUs  0m34.5s/1m0s

running (0m36.0s), 10/10 VUs, 33 complete and 0 interrupted iterations
default   [  59% ] 10 VUs  0m35.5s/1m0s

running (0m37.0s), 10/10 VUs, 36 complete and 0 interrupted iterations
default   [  61% ] 10 VUs  0m36.5s/1m0s

running (0m38.0s), 10/10 VUs, 38 complete and 0 interrupted iterations
default   [  63% ] 10 VUs  0m37.5s/1m0s

running (0m39.1s), 10/10 VUs, 38 complete and 0 interrupted iterations
default   [  64% ] 10 VUs  0m38.6s/1m0s

running (0m40.0s), 10/10 VUs, 43 complete and 0 interrupted iterations
default   [  66% ] 10 VUs  0m39.5s/1m0s

running (0m41.0s), 10/10 VUs, 43 complete and 0 interrupted iterations
default   [  68% ] 10 VUs  0m40.5s/1m0s

running (0m42.0s), 10/10 VUs, 44 complete and 0 interrupted iterations
default   [  69% ] 10 VUs  0m41.5s/1m0s

running (0m43.0s), 10/10 VUs, 45 complete and 0 interrupted iterations
default   [  71% ] 10 VUs  0m42.5s/1m0s

running (0m44.0s), 10/10 VUs, 45 complete and 0 interrupted iterations
default   [  73% ] 10 VUs  0m43.5s/1m0s

running (0m45.0s), 10/10 VUs, 45 complete and 0 interrupted iterations
default   [  74% ] 10 VUs  0m44.5s/1m0s

running (0m46.0s), 10/10 VUs, 46 complete and 0 interrupted iterations
default   [  76% ] 10 VUs  0m45.5s/1m0s

running (0m47.0s), 10/10 VUs, 48 complete and 0 interrupted iterations
default   [  78% ] 10 VUs  0m46.5s/1m0s

running (0m48.0s), 10/10 VUs, 48 complete and 0 interrupted iterations
default   [  79% ] 10 VUs  0m47.5s/1m0s

running (0m49.0s), 10/10 VUs, 48 complete and 0 interrupted iterations
default   [  81% ] 10 VUs  0m48.5s/1m0s

running (0m50.0s), 10/10 VUs, 49 complete and 0 interrupted iterations
default   [  83% ] 10 VUs  0m49.5s/1m0s

running (0m51.0s), 10/10 VUs, 49 complete and 0 interrupted iterations
default   [  84% ] 10 VUs  0m50.5s/1m0s

running (0m52.0s), 10/10 VUs, 49 complete and 0 interrupted iterations
default   [  86% ] 10 VUs  0m51.5s/1m0s

running (0m53.0s), 10/10 VUs, 49 complete and 0 interrupted iterations
default   [  88% ] 10 VUs  0m52.5s/1m0s

running (0m54.0s), 10/10 VUs, 49 complete and 0 interrupted iterations
default   [  89% ] 10 VUs  0m53.5s/1m0s

running (0m55.0s), 10/10 VUs, 49 complete and 0 interrupted iterations
default   [  91% ] 10 VUs  0m54.5s/1m0s

running (0m56.0s), 10/10 VUs, 49 complete and 0 interrupted iterations
default   [  93% ] 10 VUs  0m55.5s/1m0s

running (0m57.0s), 10/10 VUs, 49 complete and 0 interrupted iterations
default   [  94% ] 10 VUs  0m56.6s/1m0s

running (0m58.0s), 10/10 VUs, 49 complete and 0 interrupted iterations
default   [  96% ] 10 VUs  0m57.5s/1m0s

running (0m59.0s), 10/10 VUs, 49 complete and 0 interrupted iterations
default   [  98% ] 10 VUs  0m58.5s/1m0s

running (1m00.0s), 10/10 VUs, 49 complete and 0 interrupted iterations
default   [  99% ] 10 VUs  0m59.5s/1m0s

running (1m01.0s), 10/10 VUs, 49 complete and 0 interrupted iterations
default ↓ [ 100% ] 10 VUs  1m0s

running (1m02.0s), 09/10 VUs, 50 complete and 0 interrupted iterations
default ↓ [ 100% ] 10 VUs  1m0s

running (1m03.0s), 09/10 VUs, 50 complete and 0 interrupted iterations
default ↓ [ 100% ] 10 VUs  1m0s

running (1m04.0s), 09/10 VUs, 50 complete and 0 interrupted iterations
default ↓ [ 100% ] 10 VUs  1m0s

running (1m05.0s), 09/10 VUs, 50 complete and 0 interrupted iterations
default ↓ [ 100% ] 10 VUs  1m0s

running (1m06.0s), 08/10 VUs, 51 complete and 0 interrupted iterations
default ↓ [ 100% ] 10 VUs  1m0s

running (1m07.0s), 07/10 VUs, 52 complete and 0 interrupted iterations
default ↓ [ 100% ] 10 VUs  1m0s

running (1m08.0s), 07/10 VUs, 52 complete and 0 interrupted iterations
default ↓ [ 100% ] 10 VUs  1m0s

running (1m09.0s), 07/10 VUs, 52 complete and 0 interrupted iterations
default ↓ [ 100% ] 10 VUs  1m0s

running (1m10.0s), 04/10 VUs, 55 complete and 0 interrupted iterations
default ↓ [ 100% ] 10 VUs  1m0s

running (1m11.0s), 04/10 VUs, 55 complete and 0 interrupted iterations
default ↓ [ 100% ] 10 VUs  1m0s

running (1m12.0s), 04/10 VUs, 55 complete and 0 interrupted iterations
default ↓ [ 100% ] 10 VUs  1m0s

running (1m13.0s), 04/10 VUs, 55 complete and 0 interrupted iterations
default ↓ [ 100% ] 10 VUs  1m0s

running (1m14.0s), 04/10 VUs, 55 complete and 0 interrupted iterations
default ↓ [ 100% ] 10 VUs  1m0s

running (1m15.0s), 04/10 VUs, 55 complete and 0 interrupted iterations
default ↓ [ 100% ] 10 VUs  1m0s

running (1m16.0s), 04/10 VUs, 55 complete and 0 interrupted iterations
default ↓ [ 100% ] 10 VUs  1m0s

running (1m17.0s), 04/10 VUs, 55 complete and 0 interrupted iterations
default ↓ [ 100% ] 10 VUs  1m0s

running (1m18.0s), 02/10 VUs, 57 complete and 0 interrupted iterations
default ↓ [ 100% ] 10 VUs  1m0s

running (1m19.0s), 01/10 VUs, 58 complete and 0 interrupted iterations
default ↓ [ 100% ] 10 VUs  1m0s


  █ THRESHOLDS 

    http_req_duration
    ✓ 'p(95)<2000' p(95)=1.99s

    http_req_failed
    ✓ 'rate<0.05' rate=0.00%

    match_found
    ✓ 'rate>0.3' rate=100.00%

    spin_success
    ✗ 'rate>0.95' rate=76.27%


  █ TOTAL RESULTS 

    checks_total.......: 163    2.056172/s
    checks_succeeded...: 91.41% 149 out of 163
    checks_failed......: 8.58%  14 out of 163

    ✓ spin status is 200
    ✗ spin response time < 1s
      ↳  76% — ✓ 45 / ✗ 14
    ✓ vote status is 200

    CUSTOM
    match_found....................: 100.00% 45 out of 45
    match_time_ms..................: avg=10655.377778 min=1700    med=5180     max=48546  p(90)=24079.2 p(95)=32540.2
    matches_created................: 45      0.567655/s
    spin_success...................: 76.27%  45 out of 59
    spins_initiated................: 45      0.567655/s
    vote_success...................: 100.00% 45 out of 45

    HTTP
    http_req_duration..............: avg=533.51ms     min=55.22ms med=303.43ms max=3.08s  p(90)=1.36s   p(95)=1.99s  
      { expected_response:true }...: avg=533.51ms     min=55.22ms med=303.43ms max=3.08s  p(90)=1.36s   p(95)=1.99s  
    http_req_failed................: 0.00%   0 out of 319
    http_reqs......................: 319     4.024043/s

    EXECUTION
    iteration_duration.............: avg=12.03s       min=1.54s   med=8.01s    max=53.08s p(90)=23.93s  p(95)=31.48s 
    iterations.....................: 59      0.744259/s
    vus............................: 1       min=1        max=10
    vus_max........................: 10      min=10       max=10

    NETWORK
    data_received..................: 139 kB  1.8 kB/s
    data_sent......................: 52 kB   662 B/s




running (1m19.3s), 00/10 VUs, 59 complete and 0 interrupted iterations
default ✓ [ 100% ] 10 VUs  1m0s
time="2025-12-07T10:52:17Z" level=error msg="thresholds on metrics 'spin_success' have been crossed"
