
         /\      Grafana   /‾‾/  
    /\  /  \     |\  __   /  /   
   /  \/    \    | |/ /  /   ‾‾\ 
  /          \   |   (  |  (‾)  |
 / __________ \  |_|\_\  \_____/ 

     execution: local
        script: tests/k6/scenario-baseline.js
        output: -

     scenarios: (100.00%) 1 scenario, 50 max VUs, 3m30s max duration (incl. graceful stop):
              * default: 50 looping VUs for 3m0s (gracefulStop: 30s)

time="2025-12-07T11:11:18Z" level=info msg="🔧 Setting up user pool..." source=console
time="2025-12-07T11:11:18Z" level=info msg="✅ Loaded 50 male users" source=console
time="2025-12-07T11:11:18Z" level=info msg="✅ Loaded 50 female users" source=console

running (0m00.9s), 50/50 VUs, 0 complete and 0 interrupted iterations
default   [   0% ] 50 VUs  0m00.7s/3m0s

running (0m01.9s), 50/50 VUs, 1 complete and 0 interrupted iterations
default   [   1% ] 50 VUs  0m01.7s/3m0s

running (0m02.9s), 50/50 VUs, 12 complete and 0 interrupted iterations
default   [   2% ] 50 VUs  0m02.7s/3m0s

running (0m03.9s), 50/50 VUs, 22 complete and 0 interrupted iterations
default   [   2% ] 50 VUs  0m03.7s/3m0s

running (0m05.0s), 50/50 VUs, 32 complete and 0 interrupted iterations
default   [   3% ] 50 VUs  0m04.8s/3m0s

running (0m05.9s), 50/50 VUs, 34 complete and 0 interrupted iterations
default   [   3% ] 50 VUs  0m05.7s/3m0s

running (0m06.9s), 50/50 VUs, 40 complete and 0 interrupted iterations
default   [   4% ] 50 VUs  0m06.7s/3m0s

running (0m07.9s), 50/50 VUs, 49 complete and 0 interrupted iterations
default   [   4% ] 50 VUs  0m07.7s/3m0s

running (0m08.9s), 50/50 VUs, 68 complete and 0 interrupted iterations
default   [   5% ] 50 VUs  0m08.7s/3m0s

running (0m10.0s), 50/50 VUs, 88 complete and 0 interrupted iterations
default   [   5% ] 50 VUs  0m09.7s/3m0s

running (0m11.0s), 50/50 VUs, 92 complete and 0 interrupted iterations
default   [   6% ] 50 VUs  0m10.7s/3m0s

running (0m11.9s), 50/50 VUs, 113 complete and 0 interrupted iterations
default   [   7% ] 50 VUs  0m11.7s/3m0s

running (0m12.9s), 50/50 VUs, 140 complete and 0 interrupted iterations
default   [   7% ] 50 VUs  0m12.7s/3m0s

running (0m14.0s), 50/50 VUs, 143 complete and 0 interrupted iterations
default   [   8% ] 50 VUs  0m13.8s/3m0s

running (0m14.9s), 50/50 VUs, 145 complete and 0 interrupted iterations
default   [   8% ] 50 VUs  0m14.7s/3m0s

running (0m15.9s), 50/50 VUs, 156 complete and 0 interrupted iterations
default   [   9% ] 50 VUs  0m15.7s/3m0s

running (0m16.9s), 50/50 VUs, 157 complete and 0 interrupted iterations
default   [   9% ] 50 VUs  0m16.7s/3m0s

running (0m17.9s), 50/50 VUs, 170 complete and 0 interrupted iterations
default   [  10% ] 50 VUs  0m17.7s/3m0s

running (0m18.9s), 50/50 VUs, 172 complete and 0 interrupted iterations
default   [  10% ] 50 VUs  0m18.7s/3m0s
time="2025-12-07T11:11:37Z" level=info msg="⚠️ Rate limited, retrying after delay..." source=console
time="2025-12-07T11:11:38Z" level=info msg="⚠️ Rate limited, retrying after delay..." source=console

running (0m19.9s), 50/50 VUs, 176 complete and 0 interrupted iterations
default   [  11% ] 50 VUs  0m19.7s/3m0s
time="2025-12-07T11:11:38Z" level=info msg="⚠️ Rate limited, retrying after delay..." source=console
time="2025-12-07T11:11:38Z" level=info msg="⚠️ Rate limited, retrying after delay..." source=console

running (0m20.9s), 50/50 VUs, 182 complete and 0 interrupted iterations
default   [  12% ] 50 VUs  0m20.7s/3m0s
time="2025-12-07T11:11:39Z" level=info msg="⚠️ Rate limited, retrying after delay..." source=console
time="2025-12-07T11:11:39Z" level=info msg="⚠️ Rate limited, retrying after delay..." source=console
time="2025-12-07T11:11:39Z" level=info msg="⚠️ Rate limited, retrying after delay..." source=console
time="2025-12-07T11:11:39Z" level=info msg="⚠️ Rate limited, retrying after delay..." source=console

running (0m21.9s), 50/50 VUs, 188 complete and 0 interrupted iterations
default   [  12% ] 50 VUs  0m21.7s/3m0s

running (0m22.9s), 50/50 VUs, 196 complete and 0 interrupted iterations
default   [  13% ] 50 VUs  0m22.7s/3m0s

running (0m23.9s), 50/50 VUs, 204 complete and 0 interrupted iterations
default   [  13% ] 50 VUs  0m23.7s/3m0s

running (0m25.0s), 50/50 VUs, 207 complete and 0 interrupted iterations
default   [  14% ] 50 VUs  0m24.7s/3m0s

running (0m25.9s), 50/50 VUs, 218 complete and 0 interrupted iterations
default   [  14% ] 50 VUs  0m25.7s/3m0s

running (0m26.9s), 50/50 VUs, 219 complete and 0 interrupted iterations
default   [  15% ] 50 VUs  0m26.7s/3m0s

running (0m28.0s), 50/50 VUs, 221 complete and 0 interrupted iterations
default   [  15% ] 50 VUs  0m27.7s/3m0s

running (0m28.9s), 50/50 VUs, 236 complete and 0 interrupted iterations
default   [  16% ] 50 VUs  0m28.7s/3m0s

running (0m30.0s), 50/50 VUs, 246 complete and 0 interrupted iterations
default   [  17% ] 50 VUs  0m29.7s/3m0s

running (0m30.9s), 50/50 VUs, 252 complete and 0 interrupted iterations
default   [  17% ] 50 VUs  0m30.7s/3m0s

running (0m32.0s), 50/50 VUs, 258 complete and 0 interrupted iterations
default   [  18% ] 50 VUs  0m31.8s/3m0s

running (0m33.0s), 50/50 VUs, 264 complete and 0 interrupted iterations
default   [  18% ] 50 VUs  0m32.7s/3m0s

running (0m34.0s), 50/50 VUs, 274 complete and 0 interrupted iterations
default   [  19% ] 50 VUs  0m33.7s/3m0s

running (0m35.0s), 50/50 VUs, 286 complete and 0 interrupted iterations
default   [  19% ] 50 VUs  0m34.7s/3m0s

running (0m35.9s), 50/50 VUs, 293 complete and 0 interrupted iterations
default   [  20% ] 50 VUs  0m35.7s/3m0s

running (0m37.0s), 50/50 VUs, 298 complete and 0 interrupted iterations
default   [  20% ] 50 VUs  0m36.7s/3m0s

running (0m37.9s), 50/50 VUs, 301 complete and 0 interrupted iterations
default   [  21% ] 50 VUs  0m37.7s/3m0s

running (0m39.0s), 50/50 VUs, 312 complete and 0 interrupted iterations
default   [  22% ] 50 VUs  0m38.7s/3m0s

running (0m39.9s), 50/50 VUs, 312 complete and 0 interrupted iterations
default   [  22% ] 50 VUs  0m39.7s/3m0s

running (0m40.9s), 50/50 VUs, 322 complete and 0 interrupted iterations
default   [  23% ] 50 VUs  0m40.7s/3m0s

running (0m42.0s), 50/50 VUs, 327 complete and 0 interrupted iterations
default   [  23% ] 50 VUs  0m41.7s/3m0s

running (0m42.9s), 50/50 VUs, 337 complete and 0 interrupted iterations
default   [  24% ] 50 VUs  0m42.7s/3m0s

running (0m43.9s), 50/50 VUs, 347 complete and 0 interrupted iterations
default   [  24% ] 50 VUs  0m43.7s/3m0s

running (0m45.0s), 50/50 VUs, 351 complete and 0 interrupted iterations
default   [  25% ] 50 VUs  0m44.7s/3m0s

running (0m45.9s), 50/50 VUs, 359 complete and 0 interrupted iterations
default   [  25% ] 50 VUs  0m45.7s/3m0s

running (0m47.0s), 50/50 VUs, 368 complete and 0 interrupted iterations
default   [  26% ] 50 VUs  0m46.7s/3m0s

running (0m47.9s), 50/50 VUs, 380 complete and 0 interrupted iterations
default   [  27% ] 50 VUs  0m47.7s/3m0s

running (0m48.9s), 50/50 VUs, 381 complete and 0 interrupted iterations
default   [  27% ] 50 VUs  0m48.7s/3m0s

running (0m49.9s), 50/50 VUs, 387 complete and 0 interrupted iterations
default   [  28% ] 50 VUs  0m49.7s/3m0s

running (0m50.9s), 50/50 VUs, 391 complete and 0 interrupted iterations
default   [  28% ] 50 VUs  0m50.7s/3m0s
time="2025-12-07T11:12:09Z" level=info msg="⚠️ Rate limited, retrying after delay..." source=console
time="2025-12-07T11:12:10Z" level=info msg="⚠️ Rate limited, retrying after delay..." source=console

running (0m51.9s), 50/50 VUs, 397 complete and 0 interrupted iterations
default   [  29% ] 50 VUs  0m51.7s/3m0s

running (0m52.9s), 50/50 VUs, 411 complete and 0 interrupted iterations
default   [  29% ] 50 VUs  0m52.7s/3m0s

running (0m53.9s), 50/50 VUs, 421 complete and 0 interrupted iterations
default   [  30% ] 50 VUs  0m53.7s/3m0s

running (0m54.9s), 50/50 VUs, 422 complete and 0 interrupted iterations
default   [  30% ] 50 VUs  0m54.7s/3m0s

running (0m55.9s), 50/50 VUs, 426 complete and 0 interrupted iterations
default   [  31% ] 50 VUs  0m55.7s/3m0s

running (0m56.9s), 50/50 VUs, 431 complete and 0 interrupted iterations
default   [  32% ] 50 VUs  0m56.7s/3m0s

running (0m57.9s), 50/50 VUs, 440 complete and 0 interrupted iterations
default   [  32% ] 50 VUs  0m57.7s/3m0s

running (0m58.9s), 50/50 VUs, 448 complete and 0 interrupted iterations
default   [  33% ] 50 VUs  0m58.7s/3m0s

running (0m59.9s), 50/50 VUs, 457 complete and 0 interrupted iterations
default   [  33% ] 50 VUs  0m59.7s/3m0s

running (1m00.9s), 50/50 VUs, 460 complete and 0 interrupted iterations
default   [  34% ] 50 VUs  1m00.7s/3m0s

running (1m01.9s), 50/50 VUs, 466 complete and 0 interrupted iterations
default   [  34% ] 50 VUs  1m01.7s/3m0s

running (1m02.9s), 50/50 VUs, 479 complete and 0 interrupted iterations
default   [  35% ] 50 VUs  1m02.7s/3m0s

running (1m03.9s), 50/50 VUs, 486 complete and 0 interrupted iterations
default   [  35% ] 50 VUs  1m03.7s/3m0s

running (1m05.0s), 50/50 VUs, 498 complete and 0 interrupted iterations
default   [  36% ] 50 VUs  1m04.7s/3m0s

running (1m05.9s), 50/50 VUs, 507 complete and 0 interrupted iterations
default   [  37% ] 50 VUs  1m05.7s/3m0s

running (1m07.0s), 50/50 VUs, 507 complete and 0 interrupted iterations
default   [  37% ] 50 VUs  1m06.7s/3m0s

running (1m07.9s), 50/50 VUs, 507 complete and 0 interrupted iterations
default   [  38% ] 50 VUs  1m07.7s/3m0s

running (1m08.9s), 50/50 VUs, 507 complete and 0 interrupted iterations
default   [  38% ] 50 VUs  1m08.7s/3m0s

running (1m10.0s), 50/50 VUs, 507 complete and 0 interrupted iterations
default   [  39% ] 50 VUs  1m09.7s/3m0s

running (1m10.9s), 50/50 VUs, 509 complete and 0 interrupted iterations
default   [  39% ] 50 VUs  1m10.7s/3m0s

running (1m11.9s), 50/50 VUs, 509 complete and 0 interrupted iterations
default   [  40% ] 50 VUs  1m11.7s/3m0s

running (1m12.9s), 50/50 VUs, 510 complete and 0 interrupted iterations
default   [  40% ] 50 VUs  1m12.7s/3m0s

running (1m14.0s), 50/50 VUs, 510 complete and 0 interrupted iterations
default   [  41% ] 50 VUs  1m13.7s/3m0s

running (1m14.9s), 50/50 VUs, 510 complete and 0 interrupted iterations
default   [  42% ] 50 VUs  1m14.7s/3m0s

running (1m16.0s), 50/50 VUs, 510 complete and 0 interrupted iterations
default   [  42% ] 50 VUs  1m15.7s/3m0s

running (1m16.9s), 50/50 VUs, 510 complete and 0 interrupted iterations
default   [  43% ] 50 VUs  1m16.7s/3m0s

running (1m18.0s), 50/50 VUs, 510 complete and 0 interrupted iterations
default   [  43% ] 50 VUs  1m17.7s/3m0s

running (1m18.9s), 50/50 VUs, 510 complete and 0 interrupted iterations
default   [  44% ] 50 VUs  1m18.7s/3m0s

running (1m19.9s), 50/50 VUs, 510 complete and 0 interrupted iterations
default   [  44% ] 50 VUs  1m19.7s/3m0s

running (1m21.0s), 50/50 VUs, 510 complete and 0 interrupted iterations
default   [  45% ] 50 VUs  1m20.7s/3m0s

running (1m21.9s), 50/50 VUs, 510 complete and 0 interrupted iterations
default   [  45% ] 50 VUs  1m21.7s/3m0s

running (1m22.9s), 50/50 VUs, 510 complete and 0 interrupted iterations
default   [  46% ] 50 VUs  1m22.7s/3m0s

running (1m23.9s), 50/50 VUs, 510 complete and 0 interrupted iterations
default   [  47% ] 50 VUs  1m23.7s/3m0s

running (1m25.0s), 50/50 VUs, 510 complete and 0 interrupted iterations
default   [  47% ] 50 VUs  1m24.7s/3m0s

running (1m26.0s), 50/50 VUs, 510 complete and 0 interrupted iterations
default   [  48% ] 50 VUs  1m25.7s/3m0s

running (1m27.0s), 50/50 VUs, 510 complete and 0 interrupted iterations
default   [  48% ] 50 VUs  1m26.7s/3m0s

running (1m28.0s), 50/50 VUs, 510 complete and 0 interrupted iterations
default   [  49% ] 50 VUs  1m27.7s/3m0s

running (1m29.0s), 50/50 VUs, 510 complete and 0 interrupted iterations
default   [  49% ] 50 VUs  1m28.7s/3m0s

running (1m29.9s), 50/50 VUs, 511 complete and 0 interrupted iterations
default   [  50% ] 50 VUs  1m29.7s/3m0s

running (1m31.0s), 50/50 VUs, 511 complete and 0 interrupted iterations
default   [  50% ] 50 VUs  1m30.7s/3m0s

running (1m32.0s), 50/50 VUs, 511 complete and 0 interrupted iterations
default   [  51% ] 50 VUs  1m31.7s/3m0s

running (1m32.9s), 50/50 VUs, 512 complete and 0 interrupted iterations
default   [  52% ] 50 VUs  1m32.7s/3m0s

running (1m33.9s), 50/50 VUs, 512 complete and 0 interrupted iterations
default   [  52% ] 50 VUs  1m33.7s/3m0s

running (1m34.9s), 50/50 VUs, 512 complete and 0 interrupted iterations
default   [  53% ] 50 VUs  1m34.7s/3m0s

running (1m36.0s), 50/50 VUs, 514 complete and 0 interrupted iterations
default   [  53% ] 50 VUs  1m35.7s/3m0s

running (1m36.9s), 50/50 VUs, 515 complete and 0 interrupted iterations
default   [  54% ] 50 VUs  1m36.7s/3m0s

running (1m37.9s), 50/50 VUs, 518 complete and 0 interrupted iterations
default   [  54% ] 50 VUs  1m37.7s/3m0s

running (1m38.9s), 50/50 VUs, 520 complete and 0 interrupted iterations
default   [  55% ] 50 VUs  1m38.7s/3m0s
time="2025-12-07T11:12:58Z" level=info msg="⚠️ Rate limited, retrying after delay..." source=console

running (1m39.9s), 50/50 VUs, 520 complete and 0 interrupted iterations
default   [  55% ] 50 VUs  1m39.7s/3m0s
time="2025-12-07T11:12:58Z" level=info msg="⚠️ Rate limited, retrying after delay..." source=console

running (1m41.0s), 50/50 VUs, 520 complete and 0 interrupted iterations
default   [  56% ] 50 VUs  1m40.7s/3m0s
time="2025-12-07T11:12:59Z" level=info msg="⚠️ Rate limited, retrying after delay..." source=console

running (1m42.0s), 50/50 VUs, 521 complete and 0 interrupted iterations
default   [  57% ] 50 VUs  1m41.7s/3m0s

running (1m43.0s), 50/50 VUs, 525 complete and 0 interrupted iterations
default   [  57% ] 50 VUs  1m42.7s/3m0s

running (1m44.0s), 50/50 VUs, 528 complete and 0 interrupted iterations
default   [  58% ] 50 VUs  1m43.7s/3m0s

running (1m44.9s), 50/50 VUs, 531 complete and 0 interrupted iterations
default   [  58% ] 50 VUs  1m44.7s/3m0s

running (1m46.0s), 50/50 VUs, 535 complete and 0 interrupted iterations
default   [  59% ] 50 VUs  1m45.7s/3m0s

running (1m46.9s), 50/50 VUs, 538 complete and 0 interrupted iterations
default   [  59% ] 50 VUs  1m46.7s/3m0s

running (1m48.0s), 50/50 VUs, 543 complete and 0 interrupted iterations
default   [  60% ] 50 VUs  1m47.7s/3m0s

running (1m48.9s), 50/50 VUs, 546 complete and 0 interrupted iterations
default   [  60% ] 50 VUs  1m48.7s/3m0s

running (1m50.0s), 50/50 VUs, 552 complete and 0 interrupted iterations
default   [  61% ] 50 VUs  1m49.7s/3m0s
time="2025-12-07T11:13:09Z" level=info msg="⚠️ Rate limited, retrying after delay..." source=console

running (1m50.9s), 50/50 VUs, 557 complete and 0 interrupted iterations
default   [  62% ] 50 VUs  1m50.7s/3m0s
time="2025-12-07T11:13:09Z" level=info msg="⚠️ Rate limited, retrying after delay..." source=console
time="2025-12-07T11:13:09Z" level=info msg="⚠️ Rate limited, retrying after delay..." source=console
time="2025-12-07T11:13:09Z" level=info msg="⚠️ Rate limited, retrying after delay..." source=console

running (1m52.0s), 50/50 VUs, 559 complete and 0 interrupted iterations
default   [  62% ] 50 VUs  1m51.7s/3m0s

running (1m52.9s), 50/50 VUs, 563 complete and 0 interrupted iterations
default   [  63% ] 50 VUs  1m52.7s/3m0s

running (1m54.0s), 50/50 VUs, 571 complete and 0 interrupted iterations
default   [  63% ] 50 VUs  1m53.7s/3m0s

running (1m54.9s), 50/50 VUs, 575 complete and 0 interrupted iterations
default   [  64% ] 50 VUs  1m54.7s/3m0s

running (1m56.0s), 50/50 VUs, 586 complete and 0 interrupted iterations
default   [  64% ] 50 VUs  1m55.7s/3m0s

running (1m57.0s), 50/50 VUs, 590 complete and 0 interrupted iterations
default   [  65% ] 50 VUs  1m56.7s/3m0s

running (1m57.9s), 50/50 VUs, 594 complete and 0 interrupted iterations
default   [  65% ] 50 VUs  1m57.7s/3m0s

running (1m58.9s), 50/50 VUs, 605 complete and 0 interrupted iterations
default   [  66% ] 50 VUs  1m58.7s/3m0s

running (2m00.0s), 50/50 VUs, 610 complete and 0 interrupted iterations
default   [  67% ] 50 VUs  1m59.7s/3m0s

running (2m01.0s), 50/50 VUs, 617 complete and 0 interrupted iterations
default   [  67% ] 50 VUs  2m00.7s/3m0s
time="2025-12-07T11:13:19Z" level=info msg="⚠️ Rate limited, retrying after delay..." source=console
time="2025-12-07T11:13:19Z" level=info msg="⚠️ Rate limited, retrying after delay..." source=console
time="2025-12-07T11:13:19Z" level=info msg="⚠️ Rate limited, retrying after delay..." source=console

running (2m01.9s), 50/50 VUs, 628 complete and 0 interrupted iterations
default   [  68% ] 50 VUs  2m01.7s/3m0s

running (2m03.0s), 50/50 VUs, 632 complete and 0 interrupted iterations
default   [  68% ] 50 VUs  2m02.7s/3m0s

running (2m03.9s), 50/50 VUs, 643 complete and 0 interrupted iterations
default   [  69% ] 50 VUs  2m03.7s/3m0s

running (2m05.0s), 50/50 VUs, 649 complete and 0 interrupted iterations
default   [  69% ] 50 VUs  2m04.7s/3m0s

running (2m05.9s), 50/50 VUs, 655 complete and 0 interrupted iterations
default   [  70% ] 50 VUs  2m05.7s/3m0s

running (2m06.9s), 50/50 VUs, 671 complete and 0 interrupted iterations
default   [  70% ] 50 VUs  2m06.7s/3m0s

running (2m08.0s), 50/50 VUs, 671 complete and 0 interrupted iterations
default   [  71% ] 50 VUs  2m07.7s/3m0s

running (2m09.1s), 50/50 VUs, 675 complete and 0 interrupted iterations
default   [  72% ] 50 VUs  2m08.8s/3m0s
time="2025-12-07T11:13:28Z" level=info msg="⚠️ Rate limited, retrying after delay..." source=console

running (2m10.0s), 50/50 VUs, 676 complete and 0 interrupted iterations
default   [  72% ] 50 VUs  2m09.7s/3m0s
time="2025-12-07T11:13:28Z" level=info msg="⚠️ Rate limited, retrying after delay..." source=console
time="2025-12-07T11:13:29Z" level=info msg="⚠️ Rate limited, retrying after delay..." source=console
time="2025-12-07T11:13:29Z" level=info msg="⚠️ Rate limited, retrying after delay..." source=console
time="2025-12-07T11:13:29Z" level=info msg="⚠️ Rate limited, retrying after delay..." source=console

running (2m11.0s), 50/50 VUs, 685 complete and 0 interrupted iterations
default   [  73% ] 50 VUs  2m10.7s/3m0s
time="2025-12-07T11:13:29Z" level=info msg="⚠️ Rate limited, retrying after delay..." source=console
time="2025-12-07T11:13:29Z" level=info msg="⚠️ Rate limited, retrying after delay..." source=console
time="2025-12-07T11:13:29Z" level=info msg="⚠️ Rate limited, retrying after delay..." source=console
time="2025-12-07T11:13:29Z" level=info msg="⚠️ Rate limited, retrying after delay..." source=console
time="2025-12-07T11:13:29Z" level=info msg="⚠️ Rate limited, retrying after delay..." source=console

running (2m12.0s), 50/50 VUs, 686 complete and 0 interrupted iterations
default   [  73% ] 50 VUs  2m11.7s/3m0s

running (2m12.9s), 50/50 VUs, 690 complete and 0 interrupted iterations
default   [  74% ] 50 VUs  2m12.7s/3m0s

running (2m14.0s), 50/50 VUs, 695 complete and 0 interrupted iterations
default   [  74% ] 50 VUs  2m13.7s/3m0s

running (2m14.9s), 50/50 VUs, 697 complete and 0 interrupted iterations
default   [  75% ] 50 VUs  2m14.7s/3m0s

running (2m15.9s), 50/50 VUs, 699 complete and 0 interrupted iterations
default   [  75% ] 50 VUs  2m15.7s/3m0s

running (2m17.0s), 50/50 VUs, 702 complete and 0 interrupted iterations
default   [  76% ] 50 VUs  2m16.7s/3m0s

running (2m17.9s), 50/50 VUs, 703 complete and 0 interrupted iterations
default   [  77% ] 50 VUs  2m17.7s/3m0s

running (2m18.9s), 50/50 VUs, 704 complete and 0 interrupted iterations
default   [  77% ] 50 VUs  2m18.7s/3m0s
time="2025-12-07T11:13:38Z" level=info msg="⚠️ Rate limited, retrying after delay..." source=console

running (2m20.0s), 50/50 VUs, 707 complete and 0 interrupted iterations
default   [  78% ] 50 VUs  2m19.7s/3m0s
time="2025-12-07T11:13:38Z" level=info msg="⚠️ Rate limited, retrying after delay..." source=console
time="2025-12-07T11:13:38Z" level=info msg="⚠️ Rate limited, retrying after delay..." source=console

running (2m21.0s), 50/50 VUs, 709 complete and 0 interrupted iterations
default   [  78% ] 50 VUs  2m20.7s/3m0s
time="2025-12-07T11:13:39Z" level=info msg="⚠️ Rate limited, retrying after delay..." source=console
time="2025-12-07T11:13:39Z" level=info msg="⚠️ Rate limited, retrying after delay..." source=console

running (2m22.0s), 50/50 VUs, 710 complete and 0 interrupted iterations
default   [  79% ] 50 VUs  2m21.7s/3m0s

running (2m23.0s), 50/50 VUs, 712 complete and 0 interrupted iterations
default   [  79% ] 50 VUs  2m22.7s/3m0s

running (2m23.9s), 50/50 VUs, 715 complete and 0 interrupted iterations
default   [  80% ] 50 VUs  2m23.7s/3m0s

running (2m25.0s), 50/50 VUs, 716 complete and 0 interrupted iterations
default   [  80% ] 50 VUs  2m24.7s/3m0s

running (2m25.9s), 50/50 VUs, 722 complete and 0 interrupted iterations
default   [  81% ] 50 VUs  2m25.7s/3m0s

running (2m27.0s), 50/50 VUs, 723 complete and 0 interrupted iterations
default   [  82% ] 50 VUs  2m26.7s/3m0s

running (2m27.9s), 50/50 VUs, 724 complete and 0 interrupted iterations
default   [  82% ] 50 VUs  2m27.7s/3m0s

running (2m29.0s), 50/50 VUs, 727 complete and 0 interrupted iterations
default   [  83% ] 50 VUs  2m28.7s/3m0s

running (2m30.0s), 50/50 VUs, 729 complete and 0 interrupted iterations
default   [  83% ] 50 VUs  2m29.7s/3m0s

running (2m30.9s), 50/50 VUs, 735 complete and 0 interrupted iterations
default   [  84% ] 50 VUs  2m30.7s/3m0s

running (2m32.0s), 50/50 VUs, 739 complete and 0 interrupted iterations
default   [  84% ] 50 VUs  2m31.7s/3m0s

running (2m33.0s), 50/50 VUs, 745 complete and 0 interrupted iterations
default   [  85% ] 50 VUs  2m32.7s/3m0s

running (2m34.0s), 50/50 VUs, 751 complete and 0 interrupted iterations
default   [  85% ] 50 VUs  2m33.7s/3m0s

running (2m35.0s), 50/50 VUs, 760 complete and 0 interrupted iterations
default   [  86% ] 50 VUs  2m34.7s/3m0s

running (2m36.0s), 50/50 VUs, 768 complete and 0 interrupted iterations
default   [  87% ] 50 VUs  2m35.7s/3m0s

running (2m36.9s), 50/50 VUs, 780 complete and 0 interrupted iterations
default   [  87% ] 50 VUs  2m36.7s/3m0s

running (2m37.9s), 50/50 VUs, 787 complete and 0 interrupted iterations
default   [  88% ] 50 VUs  2m37.7s/3m0s

running (2m39.0s), 50/50 VUs, 793 complete and 0 interrupted iterations
default   [  88% ] 50 VUs  2m38.7s/3m0s

running (2m40.0s), 50/50 VUs, 799 complete and 0 interrupted iterations
default   [  89% ] 50 VUs  2m39.7s/3m0s
time="2025-12-07T11:13:59Z" level=info msg="⚠️ Rate limited, retrying after delay..." source=console

running (2m40.9s), 50/50 VUs, 817 complete and 0 interrupted iterations
default   [  89% ] 50 VUs  2m40.7s/3m0s
time="2025-12-07T11:13:59Z" level=info msg="⚠️ Rate limited, retrying after delay..." source=console
time="2025-12-07T11:13:59Z" level=info msg="⚠️ Rate limited, retrying after delay..." source=console
time="2025-12-07T11:13:59Z" level=info msg="⚠️ Rate limited, retrying after delay..." source=console
time="2025-12-07T11:13:59Z" level=info msg="⚠️ Rate limited, retrying after delay..." source=console
time="2025-12-07T11:13:59Z" level=info msg="⚠️ Rate limited, retrying after delay..." source=console
time="2025-12-07T11:13:59Z" level=info msg="⚠️ Rate limited, retrying after delay..." source=console
time="2025-12-07T11:13:59Z" level=info msg="⚠️ Rate limited, retrying after delay..." source=console
time="2025-12-07T11:13:59Z" level=info msg="⚠️ Rate limited, retrying after delay..." source=console
time="2025-12-07T11:13:59Z" level=info msg="⚠️ Rate limited, retrying after delay..." source=console
time="2025-12-07T11:13:59Z" level=info msg="⚠️ Rate limited, retrying after delay..." source=console

running (2m41.9s), 50/50 VUs, 824 complete and 0 interrupted iterations
default   [  90% ] 50 VUs  2m41.7s/3m0s

running (2m43.0s), 50/50 VUs, 827 complete and 0 interrupted iterations
default   [  90% ] 50 VUs  2m42.7s/3m0s

running (2m43.9s), 50/50 VUs, 843 complete and 0 interrupted iterations
default   [  91% ] 50 VUs  2m43.7s/3m0s

running (2m44.9s), 50/50 VUs, 849 complete and 0 interrupted iterations
default   [  92% ] 50 VUs  2m44.7s/3m0s

running (2m46.0s), 50/50 VUs, 850 complete and 0 interrupted iterations
default   [  92% ] 50 VUs  2m45.7s/3m0s

running (2m47.0s), 50/50 VUs, 856 complete and 0 interrupted iterations
default   [  93% ] 50 VUs  2m46.7s/3m0s

running (2m47.9s), 50/50 VUs, 875 complete and 0 interrupted iterations
default   [  93% ] 50 VUs  2m47.7s/3m0s

running (2m49.0s), 50/50 VUs, 875 complete and 0 interrupted iterations
default   [  94% ] 50 VUs  2m48.7s/3m0s

running (2m50.0s), 50/50 VUs, 877 complete and 0 interrupted iterations
default   [  94% ] 50 VUs  2m49.7s/3m0s

running (2m51.0s), 50/50 VUs, 883 complete and 0 interrupted iterations
default   [  95% ] 50 VUs  2m50.7s/3m0s
time="2025-12-07T11:14:09Z" level=info msg="⚠️ Rate limited, retrying after delay..." source=console

running (2m52.0s), 50/50 VUs, 887 complete and 0 interrupted iterations
default   [  95% ] 50 VUs  2m51.7s/3m0s

running (2m52.9s), 50/50 VUs, 893 complete and 0 interrupted iterations
default   [  96% ] 50 VUs  2m52.7s/3m0s

running (2m54.0s), 50/50 VUs, 898 complete and 0 interrupted iterations
default   [  97% ] 50 VUs  2m53.7s/3m0s

running (2m55.0s), 50/50 VUs, 902 complete and 0 interrupted iterations
default   [  97% ] 50 VUs  2m54.7s/3m0s

running (2m56.0s), 50/50 VUs, 906 complete and 0 interrupted iterations
default   [  98% ] 50 VUs  2m55.7s/3m0s

running (2m57.0s), 50/50 VUs, 911 complete and 0 interrupted iterations
default   [  98% ] 50 VUs  2m56.7s/3m0s

running (2m57.9s), 50/50 VUs, 914 complete and 0 interrupted iterations
default   [  99% ] 50 VUs  2m57.7s/3m0s

running (2m59.0s), 50/50 VUs, 918 complete and 0 interrupted iterations
default   [  99% ] 50 VUs  2m58.7s/3m0s
time="2025-12-07T11:14:18Z" level=info msg="⚠️ Rate limited, retrying after delay..." source=console
time="2025-12-07T11:14:18Z" level=info msg="⚠️ Rate limited, retrying after delay..." source=console

running (3m00.0s), 50/50 VUs, 923 complete and 0 interrupted iterations
default   [ 100% ] 50 VUs  2m59.7s/3m0s
time="2025-12-07T11:14:18Z" level=info msg="⚠️ Rate limited, retrying after delay..." source=console
time="2025-12-07T11:14:18Z" level=info msg="⚠️ Rate limited, retrying after delay..." source=console
time="2025-12-07T11:14:18Z" level=info msg="⚠️ Rate limited, retrying after delay..." source=console

running (3m01.0s), 47/50 VUs, 927 complete and 0 interrupted iterations
default ↓ [ 100% ] 50 VUs  3m0s
time="2025-12-07T11:14:19Z" level=info msg="⚠️ Rate limited, retrying after delay..." source=console
time="2025-12-07T11:14:19Z" level=info msg="⚠️ Rate limited, retrying after delay..." source=console

running (3m02.0s), 45/50 VUs, 929 complete and 0 interrupted iterations
default ↓ [ 100% ] 50 VUs  3m0s

running (3m03.0s), 41/50 VUs, 933 complete and 0 interrupted iterations
default ↓ [ 100% ] 50 VUs  3m0s

running (3m04.0s), 38/50 VUs, 936 complete and 0 interrupted iterations
default ↓ [ 100% ] 50 VUs  3m0s

running (3m05.0s), 38/50 VUs, 936 complete and 0 interrupted iterations
default ↓ [ 100% ] 50 VUs  3m0s

running (3m05.9s), 38/50 VUs, 936 complete and 0 interrupted iterations
default ↓ [ 100% ] 50 VUs  3m0s

running (3m07.0s), 37/50 VUs, 937 complete and 0 interrupted iterations
default ↓ [ 100% ] 50 VUs  3m0s

running (3m08.0s), 37/50 VUs, 937 complete and 0 interrupted iterations
default ↓ [ 100% ] 50 VUs  3m0s

running (3m09.0s), 37/50 VUs, 937 complete and 0 interrupted iterations
default ↓ [ 100% ] 50 VUs  3m0s

running (3m10.0s), 37/50 VUs, 937 complete and 0 interrupted iterations
default ↓ [ 100% ] 50 VUs  3m0s

running (3m11.0s), 37/50 VUs, 937 complete and 0 interrupted iterations
default ↓ [ 100% ] 50 VUs  3m0s

running (3m12.0s), 37/50 VUs, 937 complete and 0 interrupted iterations
default ↓ [ 100% ] 50 VUs  3m0s

running (3m13.0s), 37/50 VUs, 937 complete and 0 interrupted iterations
default ↓ [ 100% ] 50 VUs  3m0s

running (3m14.0s), 37/50 VUs, 937 complete and 0 interrupted iterations
default ↓ [ 100% ] 50 VUs  3m0s

running (3m15.0s), 37/50 VUs, 937 complete and 0 interrupted iterations
default ↓ [ 100% ] 50 VUs  3m0s

running (3m16.0s), 37/50 VUs, 937 complete and 0 interrupted iterations
default ↓ [ 100% ] 50 VUs  3m0s

running (3m17.0s), 37/50 VUs, 937 complete and 0 interrupted iterations
default ↓ [ 100% ] 50 VUs  3m0s

running (3m18.0s), 37/50 VUs, 937 complete and 0 interrupted iterations
default ↓ [ 100% ] 50 VUs  3m0s

running (3m19.0s), 37/50 VUs, 937 complete and 0 interrupted iterations
default ↓ [ 100% ] 50 VUs  3m0s

running (3m20.0s), 37/50 VUs, 937 complete and 0 interrupted iterations
default ↓ [ 100% ] 50 VUs  3m0s

running (3m21.0s), 37/50 VUs, 937 complete and 0 interrupted iterations
default ↓ [ 100% ] 50 VUs  3m0s

running (3m22.0s), 37/50 VUs, 937 complete and 0 interrupted iterations
default ↓ [ 100% ] 50 VUs  3m0s

running (3m23.0s), 37/50 VUs, 937 complete and 0 interrupted iterations
default ↓ [ 100% ] 50 VUs  3m0s

running (3m24.0s), 35/50 VUs, 939 complete and 0 interrupted iterations
default ↓ [ 100% ] 50 VUs  3m0s

running (3m25.0s), 34/50 VUs, 940 complete and 0 interrupted iterations
default ↓ [ 100% ] 50 VUs  3m0s

running (3m26.0s), 31/50 VUs, 943 complete and 0 interrupted iterations
default ↓ [ 100% ] 50 VUs  3m0s

running (3m27.0s), 30/50 VUs, 944 complete and 0 interrupted iterations
default ↓ [ 100% ] 50 VUs  3m0s

running (3m28.0s), 29/50 VUs, 945 complete and 0 interrupted iterations
default ↓ [ 100% ] 50 VUs  3m0s

running (3m29.0s), 29/50 VUs, 945 complete and 0 interrupted iterations
default ↓ [ 100% ] 50 VUs  3m0s

running (3m30.0s), 25/50 VUs, 949 complete and 0 interrupted iterations
default ↓ [ 100% ] 50 VUs  3m0s


  █ THRESHOLDS 

    http_req_duration
    ✗ 'p(95)<2000' p(95)=2.8s

    http_req_failed
    ✓ 'rate<0.05' rate=2.08%

    match_found
    ✓ 'rate>0.3' rate=100.00%

    spin_success
    ✗ 'rate>0.95' rate=13.14%


  █ TOTAL RESULTS 

    checks_total.......: 1986   9.446194/s
    checks_succeeded...: 55.79% 1108 out of 1986
    checks_failed......: 44.20% 878 out of 1986

    ✗ spin status is 200
      ↳  94% — ✓ 920 / ✗ 54
    ✗ spin response time < 1s
      ↳  17% — ✓ 169 / ✗ 805
    ✗ vote status is 200
      ↳  50% — ✓ 19 / ✗ 19

    CUSTOM
    match_found....................: 100.00% 38 out of 38
    match_time_ms..................: avg=4682.026316 min=2845    med=4531  max=6425  p(90)=6092.6 p(95)=6125.55
    matches_created................: 38      0.180743/s
    spin_success...................: 13.14%  128 out of 974
    spins_initiated................: 128     0.608818/s
    vote_success...................: 50.00%  19 out of 38

    HTTP
    http_req_duration..............: avg=1.47s       min=16.74ms med=1.43s max=7.2s  p(90)=2.42s  p(95)=2.8s   
      { expected_response:true }...: avg=1.48s       min=60.65ms med=1.44s max=7.2s  p(90)=2.43s  p(95)=2.81s  
    http_req_failed................: 2.08%   73 out of 3502
    http_reqs......................: 3502    16.656884/s

    EXECUTION
    iteration_duration.............: avg=9.38s       min=1.06s   med=3.24s max=1m39s p(90)=8.62s  p(95)=1m25s  
    iterations.....................: 950     4.518572/s
    vus............................: 25      min=25         max=50
    vus_max........................: 50      min=50         max=50

    NETWORK
    data_received..................: 1.3 MB  6.3 kB/s
    data_sent......................: 546 kB  2.6 kB/s




running (3m30.2s), 00/50 VUs, 950 complete and 24 interrupted iterations
default ✓ [ 100% ] 50 VUs  3m0s
time="2025-12-07T11:14:48Z" level=error msg="thresholds on metrics 'http_req_duration, spin_success' have been crossed"
