
         /\      Grafana   /‾‾/  
    /\  /  \     |\  __   /  /   
   /  \/    \    | |/ /  /   ‾‾\ 
  /          \   |   (  |  (‾)  |
 / __________ \  |_|\_\  \_____/ 

     execution: local
        script: tests/k6/scenario-baseline.js
        output: -

     scenarios: (100.00%) 1 scenario, 30 max VUs, 2m30s max duration (incl. graceful stop):
              * default: 30 looping VUs for 2m0s (gracefulStop: 30s)

time="2025-12-07T10:50:57Z" level=warning msg="Error from API server" error="listen tcp 127.0.0.1:6565: bind: address already in use"
time="2025-12-07T10:50:57Z" level=info msg="🔧 Setting up user pool..." source=console
time="2025-12-07T10:50:58Z" level=info msg="✅ Loaded 50 male users" source=console
time="2025-12-07T10:50:58Z" level=info msg="✅ Loaded 50 female users" source=console

running (0m01.0s), 30/30 VUs, 0 complete and 0 interrupted iterations
default   [   0% ] 30 VUs  0m00.6s/2m0s

running (0m02.0s), 30/30 VUs, 0 complete and 0 interrupted iterations
default   [   1% ] 30 VUs  0m01.6s/2m0s

running (0m03.0s), 30/30 VUs, 4 complete and 0 interrupted iterations
default   [   2% ] 30 VUs  0m02.6s/2m0s

running (0m04.0s), 30/30 VUs, 14 complete and 0 interrupted iterations
default   [   3% ] 30 VUs  0m03.6s/2m0s

running (0m05.0s), 30/30 VUs, 24 complete and 0 interrupted iterations
default   [   4% ] 30 VUs  0m04.6s/2m0s

running (0m06.0s), 30/30 VUs, 27 complete and 0 interrupted iterations
default   [   5% ] 30 VUs  0m05.6s/2m0s

running (0m07.0s), 30/30 VUs, 28 complete and 0 interrupted iterations
default   [   5% ] 30 VUs  0m06.6s/2m0s

running (0m08.0s), 30/30 VUs, 31 complete and 0 interrupted iterations
default   [   6% ] 30 VUs  0m07.6s/2m0s

running (0m09.0s), 30/30 VUs, 33 complete and 0 interrupted iterations
default   [   7% ] 30 VUs  0m08.6s/2m0s

running (0m10.0s), 30/30 VUs, 33 complete and 0 interrupted iterations
default   [   8% ] 30 VUs  0m09.6s/2m0s

running (0m11.0s), 30/30 VUs, 39 complete and 0 interrupted iterations
default   [   9% ] 30 VUs  0m10.6s/2m0s

running (0m12.0s), 30/30 VUs, 49 complete and 0 interrupted iterations
default   [  10% ] 30 VUs  0m11.6s/2m0s

running (0m13.0s), 30/30 VUs, 53 complete and 0 interrupted iterations
default   [  10% ] 30 VUs  0m12.6s/2m0s

running (0m14.1s), 30/30 VUs, 56 complete and 0 interrupted iterations
default   [  11% ] 30 VUs  0m13.6s/2m0s

running (0m15.0s), 30/30 VUs, 56 complete and 0 interrupted iterations
default   [  12% ] 30 VUs  0m14.6s/2m0s

running (0m16.0s), 30/30 VUs, 57 complete and 0 interrupted iterations
default   [  13% ] 30 VUs  0m15.6s/2m0s

running (0m17.0s), 30/30 VUs, 63 complete and 0 interrupted iterations
default   [  14% ] 30 VUs  0m16.6s/2m0s

running (0m18.0s), 30/30 VUs, 64 complete and 0 interrupted iterations
default   [  15% ] 30 VUs  0m17.6s/2m0s

running (0m19.0s), 30/30 VUs, 64 complete and 0 interrupted iterations
default   [  15% ] 30 VUs  0m18.6s/2m0s

running (0m20.0s), 30/30 VUs, 66 complete and 0 interrupted iterations
default   [  16% ] 30 VUs  0m19.6s/2m0s

running (0m21.0s), 30/30 VUs, 70 complete and 0 interrupted iterations
default   [  17% ] 30 VUs  0m20.6s/2m0s

running (0m22.0s), 30/30 VUs, 72 complete and 0 interrupted iterations
default   [  18% ] 30 VUs  0m21.6s/2m0s

running (0m23.0s), 30/30 VUs, 76 complete and 0 interrupted iterations
default   [  19% ] 30 VUs  0m22.6s/2m0s

running (0m24.0s), 30/30 VUs, 82 complete and 0 interrupted iterations
default   [  20% ] 30 VUs  0m23.6s/2m0s

running (0m25.0s), 30/30 VUs, 90 complete and 0 interrupted iterations
default   [  20% ] 30 VUs  0m24.6s/2m0s

running (0m26.0s), 30/30 VUs, 93 complete and 0 interrupted iterations
default   [  21% ] 30 VUs  0m25.6s/2m0s

running (0m27.0s), 30/30 VUs, 95 complete and 0 interrupted iterations
default   [  22% ] 30 VUs  0m26.6s/2m0s

running (0m28.0s), 30/30 VUs, 98 complete and 0 interrupted iterations
default   [  23% ] 30 VUs  0m27.6s/2m0s

running (0m29.0s), 30/30 VUs, 99 complete and 0 interrupted iterations
default   [  24% ] 30 VUs  0m28.6s/2m0s

running (0m30.0s), 30/30 VUs, 100 complete and 0 interrupted iterations
default   [  25% ] 30 VUs  0m29.6s/2m0s

running (0m31.0s), 30/30 VUs, 107 complete and 0 interrupted iterations
default   [  25% ] 30 VUs  0m30.6s/2m0s

running (0m32.0s), 30/30 VUs, 110 complete and 0 interrupted iterations
default   [  26% ] 30 VUs  0m31.6s/2m0s

running (0m33.0s), 30/30 VUs, 112 complete and 0 interrupted iterations
default   [  27% ] 30 VUs  0m32.6s/2m0s

running (0m34.0s), 30/30 VUs, 115 complete and 0 interrupted iterations
default   [  28% ] 30 VUs  0m33.6s/2m0s

running (0m35.0s), 30/30 VUs, 118 complete and 0 interrupted iterations
default   [  29% ] 30 VUs  0m34.6s/2m0s

running (0m36.0s), 30/30 VUs, 121 complete and 0 interrupted iterations
default   [  30% ] 30 VUs  0m35.6s/2m0s

running (0m37.0s), 30/30 VUs, 123 complete and 0 interrupted iterations
default   [  30% ] 30 VUs  0m36.6s/2m0s

running (0m38.0s), 30/30 VUs, 124 complete and 0 interrupted iterations
default   [  31% ] 30 VUs  0m37.6s/2m0s

running (0m39.0s), 30/30 VUs, 126 complete and 0 interrupted iterations
default   [  32% ] 30 VUs  0m38.6s/2m0s

running (0m40.0s), 30/30 VUs, 129 complete and 0 interrupted iterations
default   [  33% ] 30 VUs  0m39.6s/2m0s

running (0m41.0s), 30/30 VUs, 131 complete and 0 interrupted iterations
default   [  34% ] 30 VUs  0m40.6s/2m0s

running (0m42.0s), 30/30 VUs, 139 complete and 0 interrupted iterations
default   [  35% ] 30 VUs  0m41.6s/2m0s

running (0m43.0s), 30/30 VUs, 139 complete and 0 interrupted iterations
default   [  35% ] 30 VUs  0m42.6s/2m0s

running (0m44.0s), 30/30 VUs, 140 complete and 0 interrupted iterations
default   [  36% ] 30 VUs  0m43.6s/2m0s

running (0m45.0s), 30/30 VUs, 141 complete and 0 interrupted iterations
default   [  37% ] 30 VUs  0m44.6s/2m0s

running (0m46.0s), 30/30 VUs, 144 complete and 0 interrupted iterations
default   [  38% ] 30 VUs  0m45.6s/2m0s

running (0m47.0s), 30/30 VUs, 150 complete and 0 interrupted iterations
default   [  39% ] 30 VUs  0m46.6s/2m0s

running (0m48.0s), 30/30 VUs, 150 complete and 0 interrupted iterations
default   [  40% ] 30 VUs  0m47.6s/2m0s

running (0m49.0s), 30/30 VUs, 153 complete and 0 interrupted iterations
default   [  40% ] 30 VUs  0m48.6s/2m0s

running (0m50.0s), 30/30 VUs, 155 complete and 0 interrupted iterations
default   [  41% ] 30 VUs  0m49.6s/2m0s

running (0m51.0s), 30/30 VUs, 155 complete and 0 interrupted iterations
default   [  42% ] 30 VUs  0m50.6s/2m0s

running (0m52.0s), 30/30 VUs, 155 complete and 0 interrupted iterations
default   [  43% ] 30 VUs  0m51.6s/2m0s

running (0m53.0s), 30/30 VUs, 155 complete and 0 interrupted iterations
default   [  44% ] 30 VUs  0m52.6s/2m0s

running (0m54.0s), 30/30 VUs, 156 complete and 0 interrupted iterations
default   [  45% ] 30 VUs  0m53.6s/2m0s

running (0m55.0s), 30/30 VUs, 158 complete and 0 interrupted iterations
default   [  45% ] 30 VUs  0m54.6s/2m0s

running (0m56.0s), 30/30 VUs, 161 complete and 0 interrupted iterations
default   [  46% ] 30 VUs  0m55.6s/2m0s

running (0m57.0s), 30/30 VUs, 161 complete and 0 interrupted iterations
default   [  47% ] 30 VUs  0m56.6s/2m0s

running (0m58.0s), 30/30 VUs, 162 complete and 0 interrupted iterations
default   [  48% ] 30 VUs  0m57.6s/2m0s

running (0m59.0s), 30/30 VUs, 162 complete and 0 interrupted iterations
default   [  49% ] 30 VUs  0m58.6s/2m0s

running (1m00.0s), 30/30 VUs, 162 complete and 0 interrupted iterations
default   [  50% ] 30 VUs  0m59.6s/2m0s

running (1m01.0s), 30/30 VUs, 162 complete and 0 interrupted iterations
default   [  50% ] 30 VUs  1m00.6s/2m0s

running (1m02.0s), 30/30 VUs, 164 complete and 0 interrupted iterations
default   [  51% ] 30 VUs  1m01.6s/2m0s

running (1m03.0s), 30/30 VUs, 164 complete and 0 interrupted iterations
default   [  52% ] 30 VUs  1m02.6s/2m0s

running (1m04.0s), 30/30 VUs, 164 complete and 0 interrupted iterations
default   [  53% ] 30 VUs  1m03.6s/2m0s

running (1m05.0s), 30/30 VUs, 166 complete and 0 interrupted iterations
default   [  54% ] 30 VUs  1m04.6s/2m0s

running (1m06.0s), 30/30 VUs, 169 complete and 0 interrupted iterations
default   [  55% ] 30 VUs  1m05.6s/2m0s

running (1m07.0s), 30/30 VUs, 171 complete and 0 interrupted iterations
default   [  55% ] 30 VUs  1m06.6s/2m0s

running (1m08.0s), 30/30 VUs, 173 complete and 0 interrupted iterations
default   [  56% ] 30 VUs  1m07.6s/2m0s

running (1m09.0s), 30/30 VUs, 179 complete and 0 interrupted iterations
default   [  57% ] 30 VUs  1m08.6s/2m0s

running (1m10.0s), 30/30 VUs, 190 complete and 0 interrupted iterations
default   [  58% ] 30 VUs  1m09.6s/2m0s

running (1m11.0s), 30/30 VUs, 190 complete and 0 interrupted iterations
default   [  59% ] 30 VUs  1m10.6s/2m0s

running (1m12.0s), 30/30 VUs, 190 complete and 0 interrupted iterations
default   [  60% ] 30 VUs  1m11.6s/2m0s

running (1m13.0s), 30/30 VUs, 190 complete and 0 interrupted iterations
default   [  60% ] 30 VUs  1m12.6s/2m0s

running (1m14.0s), 30/30 VUs, 190 complete and 0 interrupted iterations
default   [  61% ] 30 VUs  1m13.6s/2m0s

running (1m15.0s), 30/30 VUs, 191 complete and 0 interrupted iterations
default   [  62% ] 30 VUs  1m14.6s/2m0s

running (1m16.0s), 30/30 VUs, 191 complete and 0 interrupted iterations
default   [  63% ] 30 VUs  1m15.6s/2m0s

running (1m17.0s), 30/30 VUs, 201 complete and 0 interrupted iterations
default   [  64% ] 30 VUs  1m16.6s/2m0s

running (1m18.0s), 30/30 VUs, 203 complete and 0 interrupted iterations
default   [  65% ] 30 VUs  1m17.6s/2m0s

running (1m19.0s), 30/30 VUs, 204 complete and 0 interrupted iterations
default   [  65% ] 30 VUs  1m18.6s/2m0s

running (1m20.0s), 30/30 VUs, 206 complete and 0 interrupted iterations
default   [  66% ] 30 VUs  1m19.6s/2m0s

running (1m21.0s), 30/30 VUs, 208 complete and 0 interrupted iterations
default   [  67% ] 30 VUs  1m20.6s/2m0s

running (1m22.0s), 30/30 VUs, 211 complete and 0 interrupted iterations
default   [  68% ] 30 VUs  1m21.6s/2m0s

running (1m23.0s), 30/30 VUs, 215 complete and 0 interrupted iterations
default   [  69% ] 30 VUs  1m22.6s/2m0s

running (1m24.0s), 30/30 VUs, 217 complete and 0 interrupted iterations
default   [  70% ] 30 VUs  1m23.6s/2m0s

running (1m25.0s), 30/30 VUs, 218 complete and 0 interrupted iterations
default   [  70% ] 30 VUs  1m24.6s/2m0s

running (1m26.0s), 30/30 VUs, 222 complete and 0 interrupted iterations
default   [  71% ] 30 VUs  1m25.6s/2m0s

running (1m27.0s), 30/30 VUs, 226 complete and 0 interrupted iterations
default   [  72% ] 30 VUs  1m26.6s/2m0s

running (1m28.0s), 30/30 VUs, 228 complete and 0 interrupted iterations
default   [  73% ] 30 VUs  1m27.6s/2m0s

running (1m29.0s), 30/30 VUs, 228 complete and 0 interrupted iterations
default   [  74% ] 30 VUs  1m28.6s/2m0s

running (1m30.0s), 30/30 VUs, 231 complete and 0 interrupted iterations
default   [  75% ] 30 VUs  1m29.6s/2m0s

running (1m31.0s), 30/30 VUs, 233 complete and 0 interrupted iterations
default   [  75% ] 30 VUs  1m30.6s/2m0s

running (1m32.0s), 30/30 VUs, 237 complete and 0 interrupted iterations
default   [  76% ] 30 VUs  1m31.6s/2m0s

running (1m33.0s), 30/30 VUs, 238 complete and 0 interrupted iterations
default   [  77% ] 30 VUs  1m32.6s/2m0s

running (1m34.0s), 30/30 VUs, 242 complete and 0 interrupted iterations
default   [  78% ] 30 VUs  1m33.6s/2m0s

running (1m35.0s), 30/30 VUs, 245 complete and 0 interrupted iterations
default   [  79% ] 30 VUs  1m34.6s/2m0s

running (1m36.0s), 30/30 VUs, 248 complete and 0 interrupted iterations
default   [  80% ] 30 VUs  1m35.6s/2m0s

running (1m37.0s), 30/30 VUs, 249 complete and 0 interrupted iterations
default   [  80% ] 30 VUs  1m36.6s/2m0s

running (1m38.0s), 30/30 VUs, 249 complete and 0 interrupted iterations
default   [  81% ] 30 VUs  1m37.6s/2m0s

running (1m39.1s), 30/30 VUs, 255 complete and 0 interrupted iterations
default   [  82% ] 30 VUs  1m38.7s/2m0s

running (1m40.0s), 30/30 VUs, 259 complete and 0 interrupted iterations
default   [  83% ] 30 VUs  1m39.6s/2m0s

running (1m41.0s), 30/30 VUs, 261 complete and 0 interrupted iterations
default   [  84% ] 30 VUs  1m40.6s/2m0s

running (1m42.0s), 30/30 VUs, 263 complete and 0 interrupted iterations
default   [  85% ] 30 VUs  1m41.6s/2m0s

running (1m43.0s), 30/30 VUs, 264 complete and 0 interrupted iterations
default   [  86% ] 30 VUs  1m42.6s/2m0s

running (1m44.0s), 30/30 VUs, 266 complete and 0 interrupted iterations
default   [  86% ] 30 VUs  1m43.6s/2m0s

running (1m45.0s), 30/30 VUs, 266 complete and 0 interrupted iterations
default   [  87% ] 30 VUs  1m44.6s/2m0s

running (1m46.0s), 30/30 VUs, 266 complete and 0 interrupted iterations
default   [  88% ] 30 VUs  1m45.6s/2m0s

running (1m47.0s), 30/30 VUs, 266 complete and 0 interrupted iterations
default   [  89% ] 30 VUs  1m46.6s/2m0s

running (1m48.0s), 30/30 VUs, 266 complete and 0 interrupted iterations
default   [  90% ] 30 VUs  1m47.6s/2m0s

running (1m49.0s), 30/30 VUs, 266 complete and 0 interrupted iterations
default   [  90% ] 30 VUs  1m48.6s/2m0s

running (1m50.0s), 30/30 VUs, 266 complete and 0 interrupted iterations
default   [  91% ] 30 VUs  1m49.6s/2m0s

running (1m51.0s), 30/30 VUs, 268 complete and 0 interrupted iterations
default   [  92% ] 30 VUs  1m50.6s/2m0s

running (1m52.0s), 30/30 VUs, 268 complete and 0 interrupted iterations
default   [  93% ] 30 VUs  1m51.6s/2m0s

running (1m53.0s), 30/30 VUs, 272 complete and 0 interrupted iterations
default   [  94% ] 30 VUs  1m52.6s/2m0s

running (1m54.0s), 30/30 VUs, 274 complete and 0 interrupted iterations
default   [  95% ] 30 VUs  1m53.6s/2m0s

running (1m55.0s), 30/30 VUs, 274 complete and 0 interrupted iterations
default   [  95% ] 30 VUs  1m54.6s/2m0s

running (1m56.0s), 30/30 VUs, 276 complete and 0 interrupted iterations
default   [  96% ] 30 VUs  1m55.6s/2m0s

running (1m57.0s), 30/30 VUs, 277 complete and 0 interrupted iterations
default   [  97% ] 30 VUs  1m56.6s/2m0s

running (1m58.0s), 30/30 VUs, 277 complete and 0 interrupted iterations
default   [  98% ] 30 VUs  1m57.6s/2m0s

running (1m59.0s), 30/30 VUs, 279 complete and 0 interrupted iterations
default   [  99% ] 30 VUs  1m58.6s/2m0s

running (2m00.0s), 30/30 VUs, 284 complete and 0 interrupted iterations
default   [ 100% ] 30 VUs  1m59.6s/2m0s

running (2m01.0s), 29/30 VUs, 285 complete and 0 interrupted iterations
default ↓ [ 100% ] 30 VUs  2m0s

running (2m02.0s), 26/30 VUs, 288 complete and 0 interrupted iterations
default ↓ [ 100% ] 30 VUs  2m0s

running (2m03.0s), 23/30 VUs, 291 complete and 0 interrupted iterations
default ↓ [ 100% ] 30 VUs  2m0s

running (2m04.0s), 19/30 VUs, 295 complete and 0 interrupted iterations
default ↓ [ 100% ] 30 VUs  2m0s

running (2m05.0s), 14/30 VUs, 300 complete and 0 interrupted iterations
default ↓ [ 100% ] 30 VUs  2m0s

running (2m06.0s), 12/30 VUs, 302 complete and 0 interrupted iterations
default ↓ [ 100% ] 30 VUs  2m0s

running (2m07.0s), 09/30 VUs, 305 complete and 0 interrupted iterations
default ↓ [ 100% ] 30 VUs  2m0s

running (2m08.0s), 04/30 VUs, 310 complete and 0 interrupted iterations
default ↓ [ 100% ] 30 VUs  2m0s

running (2m09.0s), 03/30 VUs, 311 complete and 0 interrupted iterations
default ↓ [ 100% ] 30 VUs  2m0s

running (2m10.0s), 03/30 VUs, 311 complete and 0 interrupted iterations
default ↓ [ 100% ] 30 VUs  2m0s

running (2m11.0s), 03/30 VUs, 311 complete and 0 interrupted iterations
default ↓ [ 100% ] 30 VUs  2m0s

running (2m12.0s), 01/30 VUs, 313 complete and 0 interrupted iterations
default ↓ [ 100% ] 30 VUs  2m0s

running (2m13.0s), 01/30 VUs, 313 complete and 0 interrupted iterations
default ↓ [ 100% ] 30 VUs  2m0s

running (2m14.0s), 01/30 VUs, 313 complete and 0 interrupted iterations
default ↓ [ 100% ] 30 VUs  2m0s

running (2m15.0s), 01/30 VUs, 313 complete and 0 interrupted iterations
default ↓ [ 100% ] 30 VUs  2m0s

running (2m16.0s), 01/30 VUs, 313 complete and 0 interrupted iterations
default ↓ [ 100% ] 30 VUs  2m0s

running (2m17.0s), 01/30 VUs, 313 complete and 0 interrupted iterations
default ↓ [ 100% ] 30 VUs  2m0s

running (2m18.0s), 01/30 VUs, 313 complete and 0 interrupted iterations
default ↓ [ 100% ] 30 VUs  2m0s

running (2m19.0s), 01/30 VUs, 313 complete and 0 interrupted iterations
default ↓ [ 100% ] 30 VUs  2m0s

running (2m20.0s), 00/30 VUs, 314 complete and 0 interrupted iterations
default ✓ [ 100% ] 30 VUs  2m0s


  █ THRESHOLDS 

    http_req_duration
    ✓ 'p(95)<2000' p(95)=1.49s

    http_req_failed
    ✓ 'rate<0.05' rate=0.00%

    match_found
    ✓ 'rate>0.3' rate=100.00%

    spin_success
    ✗ 'rate>0.95' rate=84.39%


  █ TOTAL RESULTS 

    checks_total.......: 893    6.380422/s
    checks_succeeded...: 94.51% 844 out of 893
    checks_failed......: 5.48%  49 out of 893

    ✓ spin status is 200
    ✗ spin response time < 1s
      ↳  84% — ✓ 265 / ✗ 49
    ✓ vote status is 200

    CUSTOM
    match_found....................: 100.00% 265 out of 265
    match_time_ms..................: avg=9626.664151 min=1547    med=4562     max=49622  p(90)=22034 p(95)=32569.2
    matches_created................: 265     1.893406/s
    spin_success...................: 84.39%  265 out of 314
    spins_initiated................: 265     1.893406/s
    vote_success...................: 100.00% 265 out of 265

    HTTP
    http_req_duration..............: avg=421.75ms    min=53.36ms med=224.05ms max=3.56s  p(90)=1.06s p(95)=1.49s  
      { expected_response:true }...: avg=421.75ms    min=53.36ms med=224.05ms max=3.56s  p(90)=1.06s p(95)=1.49s  
    http_req_failed................: 0.00%   0 out of 1757
    http_reqs......................: 1757    12.553641/s

    EXECUTION
    iteration_duration.............: avg=11.95s      min=1.22s   med=7.86s    max=53.99s p(90)=24.6s p(95)=34.32s 
    iterations.....................: 314     2.243508/s
    vus............................: 1       min=1          max=30
    vus_max........................: 30      min=30         max=30

    NETWORK
    data_received..................: 754 kB  5.4 kB/s
    data_sent......................: 290 kB  2.1 kB/s




running (2m20.0s), 00/30 VUs, 314 complete and 0 interrupted iterations
default ✓ [ 100% ] 30 VUs  2m0s
time="2025-12-07T10:53:18Z" level=error msg="thresholds on metrics 'spin_success' have been crossed"
