
         /\      Grafana   /‾‾/  
    /\  /  \     |\  __   /  /   
   /  \/    \    | |/ /  /   ‾‾\ 
  /          \   |   (  |  (‾)  |
 / __________ \  |_|\_\  \_____/ 

     execution: local
        script: tests/k6/scenario-baseline.js
        output: -

     scenarios: (100.00%) 1 scenario, 30 max VUs, 2m30s max duration (incl. graceful stop):
              * default: 30 looping VUs for 2m0s (gracefulStop: 30s)

time="2025-12-07T11:06:06Z" level=warning msg="Error from API server" error="listen tcp 127.0.0.1:6565: bind: address already in use"
time="2025-12-07T11:06:06Z" level=info msg="🔧 Setting up user pool..." source=console

Run       [ 100% ] setup()
default   [   0% ]

Run       [ 100% ] setup()
default   [   0% ]

Run       [ 100% ] setup()
default   [   0% ]
time="2025-12-07T11:06:09Z" level=info msg="✅ Loaded 50 male users" source=console

Run       [ 100% ] setup()
default   [   0% ]
time="2025-12-07T11:06:10Z" level=info msg="✅ Loaded 50 female users" source=console

running (0m05.0s), 30/30 VUs, 0 complete and 0 interrupted iterations
default   [   0% ] 30 VUs  0m00.6s/2m0s

running (0m06.0s), 30/30 VUs, 0 complete and 0 interrupted iterations
default   [   1% ] 30 VUs  0m01.6s/2m0s

running (0m07.0s), 30/30 VUs, 2 complete and 0 interrupted iterations
default   [   2% ] 30 VUs  0m02.6s/2m0s

running (0m08.0s), 30/30 VUs, 16 complete and 0 interrupted iterations
default   [   3% ] 30 VUs  0m03.6s/2m0s

running (0m09.0s), 30/30 VUs, 24 complete and 0 interrupted iterations
default   [   4% ] 30 VUs  0m04.6s/2m0s

running (0m10.0s), 30/30 VUs, 32 complete and 0 interrupted iterations
default   [   5% ] 30 VUs  0m05.6s/2m0s

running (0m11.0s), 30/30 VUs, 44 complete and 0 interrupted iterations
default   [   5% ] 30 VUs  0m06.6s/2m0s

running (0m12.0s), 30/30 VUs, 56 complete and 0 interrupted iterations
default   [   6% ] 30 VUs  0m07.6s/2m0s

running (0m13.0s), 30/30 VUs, 62 complete and 0 interrupted iterations
default   [   7% ] 30 VUs  0m08.6s/2m0s

running (0m14.0s), 30/30 VUs, 70 complete and 0 interrupted iterations
default   [   8% ] 30 VUs  0m09.6s/2m0s

running (0m15.0s), 30/30 VUs, 85 complete and 0 interrupted iterations
default   [   9% ] 30 VUs  0m10.6s/2m0s

running (0m16.0s), 30/30 VUs, 97 complete and 0 interrupted iterations
default   [  10% ] 30 VUs  0m11.6s/2m0s

running (0m17.1s), 30/30 VUs, 108 complete and 0 interrupted iterations
default   [  11% ] 30 VUs  0m12.7s/2m0s

running (0m18.0s), 30/30 VUs, 111 complete and 0 interrupted iterations
default   [  11% ] 30 VUs  0m13.6s/2m0s

running (0m19.0s), 30/30 VUs, 120 complete and 0 interrupted iterations
default   [  12% ] 30 VUs  0m14.6s/2m0s

running (0m20.0s), 30/30 VUs, 135 complete and 0 interrupted iterations
default   [  13% ] 30 VUs  0m15.6s/2m0s

running (0m21.0s), 30/30 VUs, 145 complete and 0 interrupted iterations
default   [  14% ] 30 VUs  0m16.6s/2m0s

running (0m22.0s), 30/30 VUs, 157 complete and 0 interrupted iterations
default   [  15% ] 30 VUs  0m17.6s/2m0s

running (0m23.0s), 30/30 VUs, 171 complete and 0 interrupted iterations
default   [  15% ] 30 VUs  0m18.6s/2m0s

running (0m24.0s), 30/30 VUs, 184 complete and 0 interrupted iterations
default   [  16% ] 30 VUs  0m19.6s/2m0s

running (0m25.0s), 30/30 VUs, 196 complete and 0 interrupted iterations
default   [  17% ] 30 VUs  0m20.6s/2m0s

running (0m26.0s), 30/30 VUs, 206 complete and 0 interrupted iterations
default   [  18% ] 30 VUs  0m21.6s/2m0s

running (0m27.0s), 30/30 VUs, 212 complete and 0 interrupted iterations
default   [  19% ] 30 VUs  0m22.6s/2m0s

running (0m28.0s), 30/30 VUs, 233 complete and 0 interrupted iterations
default   [  20% ] 30 VUs  0m23.6s/2m0s

running (0m29.0s), 30/30 VUs, 236 complete and 0 interrupted iterations
default   [  20% ] 30 VUs  0m24.6s/2m0s

running (0m30.0s), 30/30 VUs, 243 complete and 0 interrupted iterations
default   [  21% ] 30 VUs  0m25.6s/2m0s

running (0m31.0s), 30/30 VUs, 251 complete and 0 interrupted iterations
default   [  22% ] 30 VUs  0m26.6s/2m0s

running (0m32.0s), 30/30 VUs, 262 complete and 0 interrupted iterations
default   [  23% ] 30 VUs  0m27.6s/2m0s

running (0m33.0s), 30/30 VUs, 267 complete and 0 interrupted iterations
default   [  24% ] 30 VUs  0m28.6s/2m0s

running (0m34.0s), 30/30 VUs, 274 complete and 0 interrupted iterations
default   [  25% ] 30 VUs  0m29.6s/2m0s

running (0m35.0s), 30/30 VUs, 291 complete and 0 interrupted iterations
default   [  25% ] 30 VUs  0m30.6s/2m0s

running (0m36.0s), 30/30 VUs, 299 complete and 0 interrupted iterations
default   [  26% ] 30 VUs  0m31.6s/2m0s

running (0m37.0s), 30/30 VUs, 307 complete and 0 interrupted iterations
default   [  27% ] 30 VUs  0m32.6s/2m0s

running (0m38.0s), 30/30 VUs, 316 complete and 0 interrupted iterations
default   [  28% ] 30 VUs  0m33.6s/2m0s

running (0m39.0s), 30/30 VUs, 317 complete and 0 interrupted iterations
default   [  29% ] 30 VUs  0m34.6s/2m0s

running (0m40.0s), 30/30 VUs, 326 complete and 0 interrupted iterations
default   [  30% ] 30 VUs  0m35.6s/2m0s

running (0m41.0s), 30/30 VUs, 331 complete and 0 interrupted iterations
default   [  30% ] 30 VUs  0m36.6s/2m0s

running (0m42.0s), 30/30 VUs, 341 complete and 0 interrupted iterations
default   [  31% ] 30 VUs  0m37.6s/2m0s

running (0m43.0s), 30/30 VUs, 355 complete and 0 interrupted iterations
default   [  32% ] 30 VUs  0m38.6s/2m0s

running (0m44.0s), 30/30 VUs, 368 complete and 0 interrupted iterations
default   [  33% ] 30 VUs  0m39.6s/2m0s

running (0m45.0s), 30/30 VUs, 378 complete and 0 interrupted iterations
default   [  34% ] 30 VUs  0m40.6s/2m0s

running (0m46.0s), 30/30 VUs, 394 complete and 0 interrupted iterations
default   [  35% ] 30 VUs  0m41.6s/2m0s

running (0m47.0s), 30/30 VUs, 402 complete and 0 interrupted iterations
default   [  35% ] 30 VUs  0m42.6s/2m0s

running (0m48.0s), 30/30 VUs, 411 complete and 0 interrupted iterations
default   [  36% ] 30 VUs  0m43.6s/2m0s

running (0m49.0s), 30/30 VUs, 422 complete and 0 interrupted iterations
default   [  37% ] 30 VUs  0m44.6s/2m0s

running (0m50.0s), 30/30 VUs, 432 complete and 0 interrupted iterations
default   [  38% ] 30 VUs  0m45.6s/2m0s

running (0m51.0s), 30/30 VUs, 444 complete and 0 interrupted iterations
default   [  39% ] 30 VUs  0m46.6s/2m0s

running (0m52.0s), 30/30 VUs, 445 complete and 0 interrupted iterations
default   [  40% ] 30 VUs  0m47.6s/2m0s
time="2025-12-07T11:06:59Z" level=info msg="⚠️ Rate limited, retrying after delay..." source=console

running (0m53.0s), 30/30 VUs, 452 complete and 0 interrupted iterations
default   [  40% ] 30 VUs  0m48.6s/2m0s
time="2025-12-07T11:06:59Z" level=info msg="⚠️ Rate limited, retrying after delay..." source=console
time="2025-12-07T11:06:59Z" level=info msg="⚠️ Rate limited, retrying after delay..." source=console
time="2025-12-07T11:06:59Z" level=info msg="⚠️ Rate limited, retrying after delay..." source=console
time="2025-12-07T11:06:59Z" level=info msg="⚠️ Rate limited, retrying after delay..." source=console

running (0m54.0s), 30/30 VUs, 455 complete and 0 interrupted iterations
default   [  41% ] 30 VUs  0m49.6s/2m0s

running (0m55.0s), 30/30 VUs, 458 complete and 0 interrupted iterations
default   [  42% ] 30 VUs  0m50.6s/2m0s

running (0m56.0s), 30/30 VUs, 469 complete and 0 interrupted iterations
default   [  43% ] 30 VUs  0m51.6s/2m0s

running (0m57.0s), 30/30 VUs, 469 complete and 0 interrupted iterations
default   [  44% ] 30 VUs  0m52.6s/2m0s

running (0m58.0s), 30/30 VUs, 469 complete and 0 interrupted iterations
default   [  45% ] 30 VUs  0m53.6s/2m0s

running (0m59.0s), 30/30 VUs, 469 complete and 0 interrupted iterations
default   [  45% ] 30 VUs  0m54.6s/2m0s

running (1m00.0s), 30/30 VUs, 470 complete and 0 interrupted iterations
default   [  46% ] 30 VUs  0m55.6s/2m0s

running (1m01.0s), 30/30 VUs, 470 complete and 0 interrupted iterations
default   [  47% ] 30 VUs  0m56.6s/2m0s

running (1m02.0s), 30/30 VUs, 470 complete and 0 interrupted iterations
default   [  48% ] 30 VUs  0m57.6s/2m0s

running (1m03.0s), 30/30 VUs, 473 complete and 0 interrupted iterations
default   [  49% ] 30 VUs  0m58.6s/2m0s
time="2025-12-07T11:07:10Z" level=info msg="⚠️ Rate limited, retrying after delay..." source=console

running (1m04.0s), 30/30 VUs, 474 complete and 0 interrupted iterations
default   [  50% ] 30 VUs  0m59.6s/2m0s

running (1m05.0s), 30/30 VUs, 476 complete and 0 interrupted iterations
default   [  50% ] 30 VUs  1m00.6s/2m0s

running (1m06.0s), 30/30 VUs, 478 complete and 0 interrupted iterations
default   [  51% ] 30 VUs  1m01.6s/2m0s

running (1m07.0s), 30/30 VUs, 479 complete and 0 interrupted iterations
default   [  52% ] 30 VUs  1m02.6s/2m0s

running (1m08.0s), 30/30 VUs, 481 complete and 0 interrupted iterations
default   [  53% ] 30 VUs  1m03.6s/2m0s

running (1m09.0s), 30/30 VUs, 483 complete and 0 interrupted iterations
default   [  54% ] 30 VUs  1m04.6s/2m0s

running (1m10.0s), 30/30 VUs, 483 complete and 0 interrupted iterations
default   [  55% ] 30 VUs  1m05.6s/2m0s

running (1m11.0s), 30/30 VUs, 483 complete and 0 interrupted iterations
default   [  55% ] 30 VUs  1m06.6s/2m0s

running (1m12.0s), 30/30 VUs, 483 complete and 0 interrupted iterations
default   [  56% ] 30 VUs  1m07.6s/2m0s

running (1m13.0s), 30/30 VUs, 483 complete and 0 interrupted iterations
default   [  57% ] 30 VUs  1m08.6s/2m0s

running (1m14.0s), 30/30 VUs, 483 complete and 0 interrupted iterations
default   [  58% ] 30 VUs  1m09.6s/2m0s

running (1m15.0s), 30/30 VUs, 483 complete and 0 interrupted iterations
default   [  59% ] 30 VUs  1m10.6s/2m0s

running (1m16.0s), 30/30 VUs, 483 complete and 0 interrupted iterations
default   [  60% ] 30 VUs  1m11.6s/2m0s

running (1m17.0s), 30/30 VUs, 483 complete and 0 interrupted iterations
default   [  60% ] 30 VUs  1m12.6s/2m0s

running (1m18.0s), 30/30 VUs, 483 complete and 0 interrupted iterations
default   [  61% ] 30 VUs  1m13.6s/2m0s

running (1m19.0s), 30/30 VUs, 483 complete and 0 interrupted iterations
default   [  62% ] 30 VUs  1m14.6s/2m0s

running (1m20.0s), 30/30 VUs, 483 complete and 0 interrupted iterations
default   [  63% ] 30 VUs  1m15.6s/2m0s

running (1m21.0s), 30/30 VUs, 483 complete and 0 interrupted iterations
default   [  64% ] 30 VUs  1m16.6s/2m0s

running (1m22.0s), 30/30 VUs, 483 complete and 0 interrupted iterations
default   [  65% ] 30 VUs  1m17.6s/2m0s

running (1m23.0s), 30/30 VUs, 483 complete and 0 interrupted iterations
default   [  66% ] 30 VUs  1m18.6s/2m0s

running (1m24.0s), 30/30 VUs, 483 complete and 0 interrupted iterations
default   [  66% ] 30 VUs  1m19.6s/2m0s

running (1m25.0s), 30/30 VUs, 483 complete and 0 interrupted iterations
default   [  67% ] 30 VUs  1m20.6s/2m0s

running (1m26.0s), 30/30 VUs, 483 complete and 0 interrupted iterations
default   [  68% ] 30 VUs  1m21.6s/2m0s

running (1m27.0s), 30/30 VUs, 483 complete and 0 interrupted iterations
default   [  69% ] 30 VUs  1m22.6s/2m0s

running (1m28.0s), 30/30 VUs, 483 complete and 0 interrupted iterations
default   [  70% ] 30 VUs  1m23.6s/2m0s

running (1m29.0s), 30/30 VUs, 483 complete and 0 interrupted iterations
default   [  70% ] 30 VUs  1m24.6s/2m0s

running (1m30.0s), 30/30 VUs, 483 complete and 0 interrupted iterations
default   [  71% ] 30 VUs  1m25.6s/2m0s

running (1m31.0s), 30/30 VUs, 483 complete and 0 interrupted iterations
default   [  72% ] 30 VUs  1m26.6s/2m0s

running (1m32.0s), 30/30 VUs, 483 complete and 0 interrupted iterations
default   [  73% ] 30 VUs  1m27.6s/2m0s

running (1m33.0s), 30/30 VUs, 483 complete and 0 interrupted iterations
default   [  74% ] 30 VUs  1m28.6s/2m0s

running (1m34.0s), 30/30 VUs, 483 complete and 0 interrupted iterations
default   [  75% ] 30 VUs  1m29.6s/2m0s

running (1m35.0s), 30/30 VUs, 483 complete and 0 interrupted iterations
default   [  75% ] 30 VUs  1m30.6s/2m0s

running (1m36.0s), 30/30 VUs, 483 complete and 0 interrupted iterations
default   [  76% ] 30 VUs  1m31.6s/2m0s

running (1m37.0s), 30/30 VUs, 483 complete and 0 interrupted iterations
default   [  77% ] 30 VUs  1m32.6s/2m0s

running (1m38.0s), 30/30 VUs, 483 complete and 0 interrupted iterations
default   [  78% ] 30 VUs  1m33.6s/2m0s

running (1m39.0s), 30/30 VUs, 483 complete and 0 interrupted iterations
default   [  79% ] 30 VUs  1m34.6s/2m0s
time="2025-12-07T11:07:45Z" level=warning msg="Request Failed" error="Get \"http://localhost:3000/api/test/match-status?user_id=740a2edc-2048-4ca0-a661-239cdc53898a\": request timeout"
time="2025-12-07T11:07:46Z" level=warning msg="Request Failed" error="Get \"http://localhost:3000/api/test/match-status?user_id=7a4e2114-913e-4a14-a433-31b38708d5c5\": request timeout"

running (1m40.0s), 30/30 VUs, 483 complete and 0 interrupted iterations
default   [  80% ] 30 VUs  1m35.6s/2m0s
time="2025-12-07T11:07:46Z" level=warning msg="Request Failed" error="Get \"http://localhost:3000/api/test/match-status?user_id=f439ac32-68a1-4a23-a63d-65a1bf39a9a6\": request timeout"
time="2025-12-07T11:07:46Z" level=warning msg="Request Failed" error="Get \"http://localhost:3000/api/test/match-status?user_id=09c2d061-98a4-4a25-99f4-d11f810ace6e\": request timeout"
time="2025-12-07T11:07:46Z" level=warning msg="Request Failed" error="Get \"http://localhost:3000/api/test/match-status?user_id=05121837-21cd-4417-aa0d-b769f42b9661\": request timeout"
time="2025-12-07T11:07:46Z" level=warning msg="Request Failed" error="Get \"http://localhost:3000/api/test/match-status?user_id=831761b2-5c12-4f13-abaa-d3413b5aa8a3\": request timeout"
time="2025-12-07T11:07:46Z" level=warning msg="Request Failed" error="Get \"http://localhost:3000/api/test/match-status?user_id=ac0b3d01-66f0-48ee-b945-3b8cd506cd68\": request timeout"
time="2025-12-07T11:07:46Z" level=warning msg="Request Failed" error="Get \"http://localhost:3000/api/test/match-status?user_id=4814b06f-95f3-4ac8-a721-bbb6043b4722\": request timeout"
time="2025-12-07T11:07:46Z" level=warning msg="Request Failed" error="Get \"http://localhost:3000/api/test/match-status?user_id=e88e332c-243a-40ea-be36-a647e9dbe754\": request timeout"
time="2025-12-07T11:07:46Z" level=warning msg="Request Failed" error="Get \"http://localhost:3000/api/test/match-status?user_id=09c2d061-98a4-4a25-99f4-d11f810ace6e\": request timeout"
time="2025-12-07T11:07:46Z" level=warning msg="Request Failed" error="Get \"http://localhost:3000/api/test/match-status?user_id=f439ac32-68a1-4a23-a63d-65a1bf39a9a6\": request timeout"
time="2025-12-07T11:07:46Z" level=warning msg="Request Failed" error="Get \"http://localhost:3000/api/test/match-status?user_id=4814b06f-95f3-4ac8-a721-bbb6043b4722\": request timeout"
time="2025-12-07T11:07:46Z" level=warning msg="Request Failed" error="Get \"http://localhost:3000/api/test/match-status?user_id=4a45441c-40bd-48fa-985a-1cfe9802def5\": request timeout"
time="2025-12-07T11:07:46Z" level=warning msg="Request Failed" error="Get \"http://localhost:3000/api/test/match-status?user_id=7a4e2114-913e-4a14-a433-31b38708d5c5\": request timeout"
time="2025-12-07T11:07:46Z" level=warning msg="Request Failed" error="Get \"http://localhost:3000/api/test/match-status?user_id=e88e332c-243a-40ea-be36-a647e9dbe754\": request timeout"

running (1m41.0s), 30/30 VUs, 483 complete and 0 interrupted iterations
default   [  80% ] 30 VUs  1m36.6s/2m0s
time="2025-12-07T11:07:47Z" level=warning msg="Request Failed" error="Get \"http://localhost:3000/api/test/match-status?user_id=81e7689f-afb1-44fe-a445-9095ae4e3038\": request timeout"
time="2025-12-07T11:07:47Z" level=warning msg="Request Failed" error="Get \"http://localhost:3000/api/test/match-status?user_id=831761b2-5c12-4f13-abaa-d3413b5aa8a3\": request timeout"
time="2025-12-07T11:07:47Z" level=warning msg="Request Failed" error="Get \"http://localhost:3000/api/test/match-status?user_id=f5cd1c0d-bea1-4404-97bc-bff7950833d5\": request timeout"
time="2025-12-07T11:07:47Z" level=warning msg="Request Failed" error="Get \"http://localhost:3000/api/test/match-status?user_id=7be58443-cd98-453c-a0f2-4db6ba82a9d6\": request timeout"
time="2025-12-07T11:07:47Z" level=warning msg="Request Failed" error="Get \"http://localhost:3000/api/test/match-status?user_id=09c2d061-98a4-4a25-99f4-d11f810ace6e\": request timeout"
time="2025-12-07T11:07:48Z" level=warning msg="Request Failed" error="Get \"http://localhost:3000/api/test/match-status?user_id=09c2d061-98a4-4a25-99f4-d11f810ace6e\": request timeout"
time="2025-12-07T11:07:48Z" level=warning msg="Request Failed" error="Get \"http://localhost:3000/api/test/match-status?user_id=55ccf45c-a5bb-4a20-834c-8982e8cd481e\": request timeout"
time="2025-12-07T11:07:48Z" level=warning msg="Request Failed" error="Get \"http://localhost:3000/api/test/match-status?user_id=80612579-b0a0-472b-a50e-14af2c9a2663\": request timeout"

running (1m42.0s), 30/30 VUs, 483 complete and 0 interrupted iterations
default   [  81% ] 30 VUs  1m37.6s/2m0s
time="2025-12-07T11:07:48Z" level=warning msg="Request Failed" error="Get \"http://localhost:3000/api/test/match-status?user_id=09c2d061-98a4-4a25-99f4-d11f810ace6e\": request timeout"
time="2025-12-07T11:07:48Z" level=warning msg="Request Failed" error="Get \"http://localhost:3000/api/test/match-status?user_id=55ccf45c-a5bb-4a20-834c-8982e8cd481e\": request timeout"
time="2025-12-07T11:07:48Z" level=warning msg="Request Failed" error="Get \"http://localhost:3000/api/test/match-status?user_id=4a8150f0-93ba-487b-93f2-544aef0628c5\": request timeout"
time="2025-12-07T11:07:48Z" level=warning msg="Request Failed" error="Get \"http://localhost:3000/api/test/match-status?user_id=f439ac32-68a1-4a23-a63d-65a1bf39a9a6\": request timeout"
time="2025-12-07T11:07:48Z" level=warning msg="Request Failed" error="Get \"http://localhost:3000/api/test/match-status?user_id=4a45441c-40bd-48fa-985a-1cfe9802def5\": request timeout"
time="2025-12-07T11:07:48Z" level=warning msg="Request Failed" error="Get \"http://localhost:3000/api/test/match-status?user_id=a021e510-0d02-4959-b604-ed9e686712cf\": request timeout"

running (1m43.0s), 30/30 VUs, 483 complete and 0 interrupted iterations
default   [  82% ] 30 VUs  1m38.6s/2m0s
time="2025-12-07T11:07:49Z" level=warning msg="Request Failed" error="Get \"http://localhost:3000/api/test/match-status?user_id=80612579-b0a0-472b-a50e-14af2c9a2663\": request timeout"

running (1m44.0s), 30/30 VUs, 483 complete and 0 interrupted iterations
default   [  83% ] 30 VUs  1m39.6s/2m0s

running (1m45.0s), 30/30 VUs, 483 complete and 0 interrupted iterations
default   [  84% ] 30 VUs  1m40.6s/2m0s

running (1m46.0s), 30/30 VUs, 483 complete and 0 interrupted iterations
default   [  85% ] 30 VUs  1m41.6s/2m0s

running (1m47.0s), 30/30 VUs, 483 complete and 0 interrupted iterations
default   [  85% ] 30 VUs  1m42.6s/2m0s

running (1m48.0s), 30/30 VUs, 483 complete and 0 interrupted iterations
default   [  86% ] 30 VUs  1m43.6s/2m0s

running (1m49.0s), 30/30 VUs, 483 complete and 0 interrupted iterations
default   [  87% ] 30 VUs  1m44.6s/2m0s

running (1m50.0s), 30/30 VUs, 483 complete and 0 interrupted iterations
default   [  88% ] 30 VUs  1m45.6s/2m0s

running (1m51.0s), 30/30 VUs, 483 complete and 0 interrupted iterations
default   [  89% ] 30 VUs  1m46.6s/2m0s

running (1m52.0s), 30/30 VUs, 483 complete and 0 interrupted iterations
default   [  90% ] 30 VUs  1m47.6s/2m0s

running (1m53.0s), 30/30 VUs, 483 complete and 0 interrupted iterations
default   [  90% ] 30 VUs  1m48.6s/2m0s

running (1m54.0s), 30/30 VUs, 483 complete and 0 interrupted iterations
default   [  91% ] 30 VUs  1m49.6s/2m0s

running (1m55.0s), 30/30 VUs, 483 complete and 0 interrupted iterations
default   [  92% ] 30 VUs  1m50.6s/2m0s

running (1m56.0s), 30/30 VUs, 483 complete and 0 interrupted iterations
default   [  93% ] 30 VUs  1m51.6s/2m0s

running (1m57.0s), 30/30 VUs, 483 complete and 0 interrupted iterations
default   [  94% ] 30 VUs  1m52.6s/2m0s

running (1m58.0s), 30/30 VUs, 483 complete and 0 interrupted iterations
default   [  95% ] 30 VUs  1m53.6s/2m0s

running (1m59.0s), 30/30 VUs, 484 complete and 0 interrupted iterations
default   [  95% ] 30 VUs  1m54.6s/2m0s

running (2m00.0s), 30/30 VUs, 485 complete and 0 interrupted iterations
default   [  96% ] 30 VUs  1m55.6s/2m0s

running (2m01.0s), 30/30 VUs, 487 complete and 0 interrupted iterations
default   [  97% ] 30 VUs  1m56.6s/2m0s

running (2m02.0s), 30/30 VUs, 488 complete and 0 interrupted iterations
default   [  98% ] 30 VUs  1m57.6s/2m0s

running (2m03.0s), 30/30 VUs, 491 complete and 0 interrupted iterations
default   [  99% ] 30 VUs  1m58.6s/2m0s
time="2025-12-07T11:08:09Z" level=info msg="⚠️ Rate limited, retrying after delay..." source=console
time="2025-12-07T11:08:09Z" level=info msg="⚠️ Rate limited, retrying after delay..." source=console

running (2m04.0s), 30/30 VUs, 493 complete and 0 interrupted iterations
default   [ 100% ] 30 VUs  1m59.6s/2m0s

running (2m05.0s), 30/30 VUs, 494 complete and 0 interrupted iterations
default ↓ [ 100% ] 30 VUs  2m0s

running (2m06.0s), 22/30 VUs, 502 complete and 0 interrupted iterations
default ↓ [ 100% ] 30 VUs  2m0s

running (2m07.0s), 21/30 VUs, 503 complete and 0 interrupted iterations
default ↓ [ 100% ] 30 VUs  2m0s

running (2m08.0s), 20/30 VUs, 504 complete and 0 interrupted iterations
default ↓ [ 100% ] 30 VUs  2m0s

running (2m09.0s), 14/30 VUs, 510 complete and 0 interrupted iterations
default ↓ [ 100% ] 30 VUs  2m0s

running (2m10.0s), 12/30 VUs, 512 complete and 0 interrupted iterations
default ↓ [ 100% ] 30 VUs  2m0s

running (2m11.0s), 11/30 VUs, 513 complete and 0 interrupted iterations
default ↓ [ 100% ] 30 VUs  2m0s

running (2m12.0s), 10/30 VUs, 514 complete and 0 interrupted iterations
default ↓ [ 100% ] 30 VUs  2m0s

running (2m13.0s), 10/30 VUs, 514 complete and 0 interrupted iterations
default ↓ [ 100% ] 30 VUs  2m0s

running (2m14.0s), 10/30 VUs, 514 complete and 0 interrupted iterations
default ↓ [ 100% ] 30 VUs  2m0s

running (2m15.0s), 10/30 VUs, 514 complete and 0 interrupted iterations
default ↓ [ 100% ] 30 VUs  2m0s

running (2m16.0s), 10/30 VUs, 514 complete and 0 interrupted iterations
default ↓ [ 100% ] 30 VUs  2m0s

running (2m17.0s), 10/30 VUs, 514 complete and 0 interrupted iterations
default ↓ [ 100% ] 30 VUs  2m0s

running (2m18.0s), 09/30 VUs, 515 complete and 0 interrupted iterations
default ↓ [ 100% ] 30 VUs  2m0s

running (2m19.0s), 07/30 VUs, 517 complete and 0 interrupted iterations
default ↓ [ 100% ] 30 VUs  2m0s

running (2m20.0s), 07/30 VUs, 517 complete and 0 interrupted iterations
default ↓ [ 100% ] 30 VUs  2m0s

running (2m21.0s), 06/30 VUs, 518 complete and 0 interrupted iterations
default ↓ [ 100% ] 30 VUs  2m0s

running (2m22.0s), 06/30 VUs, 518 complete and 0 interrupted iterations
default ↓ [ 100% ] 30 VUs  2m0s

running (2m23.0s), 06/30 VUs, 518 complete and 0 interrupted iterations
default ↓ [ 100% ] 30 VUs  2m0s

running (2m24.0s), 06/30 VUs, 518 complete and 0 interrupted iterations
default ↓ [ 100% ] 30 VUs  2m0s

running (2m25.0s), 06/30 VUs, 518 complete and 0 interrupted iterations
default ↓ [ 100% ] 30 VUs  2m0s

running (2m26.0s), 06/30 VUs, 518 complete and 0 interrupted iterations
default ↓ [ 100% ] 30 VUs  2m0s

running (2m27.0s), 06/30 VUs, 518 complete and 0 interrupted iterations
default ↓ [ 100% ] 30 VUs  2m0s

running (2m28.0s), 06/30 VUs, 518 complete and 0 interrupted iterations
default ↓ [ 100% ] 30 VUs  2m0s

running (2m29.0s), 06/30 VUs, 518 complete and 0 interrupted iterations
default ↓ [ 100% ] 30 VUs  2m0s

running (2m30.0s), 06/30 VUs, 518 complete and 0 interrupted iterations
default ↓ [ 100% ] 30 VUs  2m0s

running (2m31.0s), 06/30 VUs, 518 complete and 0 interrupted iterations
default ↓ [ 100% ] 30 VUs  2m0s

running (2m32.0s), 06/30 VUs, 518 complete and 0 interrupted iterations
default ↓ [ 100% ] 30 VUs  2m0s

running (2m33.0s), 06/30 VUs, 518 complete and 0 interrupted iterations
default ↓ [ 100% ] 30 VUs  2m0s

running (2m34.0s), 06/30 VUs, 518 complete and 0 interrupted iterations
default ↓ [ 100% ] 30 VUs  2m0s


  █ THRESHOLDS 

    http_req_duration
    ✗ 'p(95)<2000' p(95)=3s

    http_req_failed
    ✓ 'rate<0.05' rate=2.64%

    match_found
    ✓ 'rate>0.3' rate=100.00%

    spin_success
    ✗ 'rate>0.95' rate=8.20%


  █ TOTAL RESULTS 

    checks_total.......: 1055   6.832406/s
    checks_succeeded...: 54.02% 570 out of 1055
    checks_failed......: 45.97% 485 out of 1055

    ✗ spin status is 200
      ↳  98% — ✓ 516 / ✗ 8
    ✗ spin response time < 1s
      ↳  9% — ✓ 50 / ✗ 474
    ✗ vote status is 200
      ↳  57% — ✓ 4 / ✗ 3

    CUSTOM
    match_found....................: 100.00% 7 out of 7
    match_time_ms..................: avg=5120.714286 min=1937    med=5090     max=7210  p(90)=7205.2 p(95)=7207.6
    matches_created................: 7       0.045334/s
    spin_success...................: 8.20%   43 out of 524
    spins_initiated................: 43      0.278477/s
    vote_success...................: 57.14%  4 out of 7

    HTTP
    http_req_duration..............: avg=1.17s       min=61.46ms med=983.71ms max=5.43s p(90)=2.33s  p(95)=3s    
      { expected_response:true }...: avg=1.1s        min=61.46ms med=953.96ms max=5.43s p(90)=2.19s  p(95)=2.64s 
    http_req_failed................: 2.64%   41 out of 1551
    http_reqs......................: 1551    10.044608/s

    EXECUTION
    iteration_duration.............: avg=7.13s       min=1.12s   med=2.92s    max=1m18s p(90)=5.06s  p(95)=1m11s 
    iterations.....................: 518     3.354679/s
    vus............................: 6       min=0          max=30
    vus_max........................: 30      min=30         max=30

    NETWORK
    data_received..................: 583 kB  3.8 kB/s
    data_sent......................: 247 kB  1.6 kB/s




running (2m34.4s), 00/30 VUs, 518 complete and 6 interrupted iterations
default ✓ [ 100% ] 30 VUs  2m0s
time="2025-12-07T11:08:40Z" level=error msg="thresholds on metrics 'http_req_duration, spin_success' have been crossed"
