
         /\      Grafana   /‾‾/  
    /\  /  \     |\  __   /  /   
   /  \/    \    | |/ /  /   ‾‾\ 
  /          \   |   (  |  (‾)  |
 / __________ \  |_|\_\  \_____/ 

     execution: local
        script: tests/k6/scenario-baseline.js
        output: -

     scenarios: (100.00%) 1 scenario, 10 max VUs, 1m30s max duration (incl. graceful stop):
              * default: 10 looping VUs for 1m0s (gracefulStop: 30s)

time="2025-12-07T11:49:11Z" level=info msg="🔧 Setting up user pool..." source=console
time="2025-12-07T11:49:12Z" level=info msg="✅ Loaded 50 male users" source=console

Run       [ 100% ] setup()
default   [   0% ]
time="2025-12-07T11:49:12Z" level=info msg="✅ Loaded 50 female users" source=console

running (0m02.0s), 10/10 VUs, 0 complete and 0 interrupted iterations
default   [   2% ] 10 VUs  0m00.9s/1m0s

running (0m03.0s), 10/10 VUs, 0 complete and 0 interrupted iterations
default   [   3% ] 10 VUs  0m01.9s/1m0s

running (0m04.0s), 10/10 VUs, 0 complete and 0 interrupted iterations
default   [   5% ] 10 VUs  0m02.9s/1m0s

running (0m05.0s), 10/10 VUs, 0 complete and 0 interrupted iterations
default   [   7% ] 10 VUs  0m03.9s/1m0s

running (0m06.0s), 10/10 VUs, 0 complete and 0 interrupted iterations
default   [   8% ] 10 VUs  0m04.9s/1m0s

running (0m07.0s), 10/10 VUs, 0 complete and 0 interrupted iterations
default   [  10% ] 10 VUs  0m05.9s/1m0s

running (0m08.0s), 10/10 VUs, 0 complete and 0 interrupted iterations
default   [  12% ] 10 VUs  0m06.9s/1m0s

running (0m09.0s), 10/10 VUs, 0 complete and 0 interrupted iterations
default   [  13% ] 10 VUs  0m07.9s/1m0s

running (0m10.0s), 10/10 VUs, 0 complete and 0 interrupted iterations
default   [  15% ] 10 VUs  0m08.9s/1m0s

running (0m11.0s), 10/10 VUs, 0 complete and 0 interrupted iterations
default   [  17% ] 10 VUs  0m09.9s/1m0s

running (0m12.0s), 10/10 VUs, 0 complete and 0 interrupted iterations
default   [  18% ] 10 VUs  0m10.9s/1m0s

running (0m13.0s), 10/10 VUs, 0 complete and 0 interrupted iterations
default   [  20% ] 10 VUs  0m11.9s/1m0s

running (0m14.0s), 10/10 VUs, 0 complete and 0 interrupted iterations
default   [  22% ] 10 VUs  0m12.9s/1m0s

running (0m15.0s), 10/10 VUs, 0 complete and 0 interrupted iterations
default   [  23% ] 10 VUs  0m13.9s/1m0s

running (0m16.0s), 10/10 VUs, 0 complete and 0 interrupted iterations
default   [  25% ] 10 VUs  0m14.9s/1m0s

running (0m17.0s), 10/10 VUs, 0 complete and 0 interrupted iterations
default   [  27% ] 10 VUs  0m15.9s/1m0s

running (0m18.0s), 10/10 VUs, 0 complete and 0 interrupted iterations
default   [  28% ] 10 VUs  0m16.9s/1m0s

running (0m19.0s), 10/10 VUs, 0 complete and 0 interrupted iterations
default   [  30% ] 10 VUs  0m17.9s/1m0s

running (0m20.0s), 10/10 VUs, 0 complete and 0 interrupted iterations
default   [  32% ] 10 VUs  0m18.9s/1m0s

running (0m21.0s), 10/10 VUs, 0 complete and 0 interrupted iterations
default   [  33% ] 10 VUs  0m19.9s/1m0s

running (0m22.0s), 10/10 VUs, 0 complete and 0 interrupted iterations
default   [  35% ] 10 VUs  0m20.9s/1m0s

running (0m23.0s), 10/10 VUs, 0 complete and 0 interrupted iterations
default   [  37% ] 10 VUs  0m21.9s/1m0s

running (0m24.0s), 10/10 VUs, 0 complete and 0 interrupted iterations
default   [  38% ] 10 VUs  0m22.9s/1m0s

running (0m25.0s), 10/10 VUs, 0 complete and 0 interrupted iterations
default   [  40% ] 10 VUs  0m23.9s/1m0s

running (0m26.0s), 10/10 VUs, 0 complete and 0 interrupted iterations
default   [  42% ] 10 VUs  0m24.9s/1m0s

running (0m27.0s), 10/10 VUs, 0 complete and 0 interrupted iterations
default   [  43% ] 10 VUs  0m25.9s/1m0s

running (0m28.0s), 10/10 VUs, 0 complete and 0 interrupted iterations
default   [  45% ] 10 VUs  0m26.9s/1m0s

running (0m29.0s), 10/10 VUs, 0 complete and 0 interrupted iterations
default   [  47% ] 10 VUs  0m27.9s/1m0s

running (0m30.0s), 10/10 VUs, 0 complete and 0 interrupted iterations
default   [  48% ] 10 VUs  0m28.9s/1m0s

running (0m31.0s), 10/10 VUs, 0 complete and 0 interrupted iterations
default   [  50% ] 10 VUs  0m29.9s/1m0s

running (0m32.0s), 10/10 VUs, 0 complete and 0 interrupted iterations
default   [  52% ] 10 VUs  0m30.9s/1m0s

running (0m33.0s), 10/10 VUs, 0 complete and 0 interrupted iterations
default   [  53% ] 10 VUs  0m31.9s/1m0s

running (0m34.0s), 10/10 VUs, 0 complete and 0 interrupted iterations
default   [  55% ] 10 VUs  0m32.9s/1m0s

running (0m35.0s), 10/10 VUs, 0 complete and 0 interrupted iterations
default   [  57% ] 10 VUs  0m33.9s/1m0s

running (0m36.0s), 10/10 VUs, 0 complete and 0 interrupted iterations
default   [  58% ] 10 VUs  0m34.9s/1m0s

running (0m37.0s), 10/10 VUs, 0 complete and 0 interrupted iterations
default   [  60% ] 10 VUs  0m35.9s/1m0s

running (0m38.0s), 10/10 VUs, 0 complete and 0 interrupted iterations
default   [  62% ] 10 VUs  0m36.9s/1m0s

running (0m39.0s), 10/10 VUs, 0 complete and 0 interrupted iterations
default   [  63% ] 10 VUs  0m37.9s/1m0s

running (0m40.0s), 10/10 VUs, 0 complete and 0 interrupted iterations
default   [  65% ] 10 VUs  0m38.9s/1m0s

running (0m41.0s), 10/10 VUs, 0 complete and 0 interrupted iterations
default   [  67% ] 10 VUs  0m39.9s/1m0s

running (0m42.0s), 10/10 VUs, 0 complete and 0 interrupted iterations
default   [  68% ] 10 VUs  0m40.9s/1m0s

running (0m43.0s), 10/10 VUs, 0 complete and 0 interrupted iterations
default   [  70% ] 10 VUs  0m41.9s/1m0s

running (0m44.0s), 10/10 VUs, 0 complete and 0 interrupted iterations
default   [  72% ] 10 VUs  0m42.9s/1m0s

running (0m45.0s), 10/10 VUs, 0 complete and 0 interrupted iterations
default   [  73% ] 10 VUs  0m43.9s/1m0s

running (0m46.0s), 10/10 VUs, 0 complete and 0 interrupted iterations
default   [  75% ] 10 VUs  0m44.9s/1m0s

running (0m47.0s), 10/10 VUs, 1 complete and 0 interrupted iterations
default   [  77% ] 10 VUs  0m45.9s/1m0s

running (0m48.0s), 10/10 VUs, 3 complete and 0 interrupted iterations
default   [  78% ] 10 VUs  0m46.9s/1m0s

running (0m49.0s), 10/10 VUs, 8 complete and 0 interrupted iterations
default   [  80% ] 10 VUs  0m47.9s/1m0s

running (0m50.0s), 10/10 VUs, 9 complete and 0 interrupted iterations
default   [  82% ] 10 VUs  0m48.9s/1m0s

running (0m51.0s), 10/10 VUs, 10 complete and 0 interrupted iterations
default   [  83% ] 10 VUs  0m49.9s/1m0s

running (0m52.0s), 10/10 VUs, 10 complete and 0 interrupted iterations
default   [  85% ] 10 VUs  0m50.9s/1m0s

running (0m53.0s), 10/10 VUs, 10 complete and 0 interrupted iterations
default   [  87% ] 10 VUs  0m51.9s/1m0s

running (0m54.0s), 10/10 VUs, 10 complete and 0 interrupted iterations
default   [  88% ] 10 VUs  0m52.9s/1m0s

running (0m55.0s), 10/10 VUs, 10 complete and 0 interrupted iterations
default   [  90% ] 10 VUs  0m53.9s/1m0s

running (0m56.0s), 10/10 VUs, 10 complete and 0 interrupted iterations
default   [  92% ] 10 VUs  0m54.9s/1m0s

running (0m57.0s), 10/10 VUs, 10 complete and 0 interrupted iterations
default   [  93% ] 10 VUs  0m55.9s/1m0s

running (0m58.0s), 10/10 VUs, 10 complete and 0 interrupted iterations
default   [  95% ] 10 VUs  0m56.9s/1m0s

running (0m59.0s), 10/10 VUs, 10 complete and 0 interrupted iterations
default   [  97% ] 10 VUs  0m57.9s/1m0s

running (1m00.0s), 10/10 VUs, 10 complete and 0 interrupted iterations
default   [  98% ] 10 VUs  0m58.9s/1m0s

running (1m01.0s), 10/10 VUs, 10 complete and 0 interrupted iterations
default   [ 100% ] 10 VUs  0m59.9s/1m0s

running (1m02.0s), 10/10 VUs, 10 complete and 0 interrupted iterations
default ↓ [ 100% ] 10 VUs  1m0s

running (1m03.0s), 10/10 VUs, 10 complete and 0 interrupted iterations
default ↓ [ 100% ] 10 VUs  1m0s

running (1m04.0s), 10/10 VUs, 10 complete and 0 interrupted iterations
default ↓ [ 100% ] 10 VUs  1m0s

running (1m05.0s), 10/10 VUs, 10 complete and 0 interrupted iterations
default ↓ [ 100% ] 10 VUs  1m0s

running (1m06.0s), 10/10 VUs, 10 complete and 0 interrupted iterations
default ↓ [ 100% ] 10 VUs  1m0s

running (1m07.0s), 10/10 VUs, 10 complete and 0 interrupted iterations
default ↓ [ 100% ] 10 VUs  1m0s

running (1m08.0s), 10/10 VUs, 10 complete and 0 interrupted iterations
default ↓ [ 100% ] 10 VUs  1m0s

running (1m09.0s), 10/10 VUs, 10 complete and 0 interrupted iterations
default ↓ [ 100% ] 10 VUs  1m0s

running (1m10.0s), 10/10 VUs, 10 complete and 0 interrupted iterations
default ↓ [ 100% ] 10 VUs  1m0s

running (1m11.0s), 10/10 VUs, 10 complete and 0 interrupted iterations
default ↓ [ 100% ] 10 VUs  1m0s

running (1m12.0s), 10/10 VUs, 10 complete and 0 interrupted iterations
default ↓ [ 100% ] 10 VUs  1m0s

running (1m13.0s), 10/10 VUs, 10 complete and 0 interrupted iterations
default ↓ [ 100% ] 10 VUs  1m0s

running (1m14.0s), 10/10 VUs, 10 complete and 0 interrupted iterations
default ↓ [ 100% ] 10 VUs  1m0s

running (1m15.0s), 10/10 VUs, 10 complete and 0 interrupted iterations
default ↓ [ 100% ] 10 VUs  1m0s

running (1m16.0s), 10/10 VUs, 10 complete and 0 interrupted iterations
default ↓ [ 100% ] 10 VUs  1m0s

running (1m17.0s), 10/10 VUs, 10 complete and 0 interrupted iterations
default ↓ [ 100% ] 10 VUs  1m0s

running (1m18.0s), 10/10 VUs, 10 complete and 0 interrupted iterations
default ↓ [ 100% ] 10 VUs  1m0s

running (1m19.0s), 10/10 VUs, 10 complete and 0 interrupted iterations
default ↓ [ 100% ] 10 VUs  1m0s

running (1m20.0s), 10/10 VUs, 10 complete and 0 interrupted iterations
default ↓ [ 100% ] 10 VUs  1m0s

running (1m21.0s), 10/10 VUs, 10 complete and 0 interrupted iterations
default ↓ [ 100% ] 10 VUs  1m0s

running (1m22.0s), 10/10 VUs, 10 complete and 0 interrupted iterations
default ↓ [ 100% ] 10 VUs  1m0s

running (1m23.0s), 10/10 VUs, 10 complete and 0 interrupted iterations
default ↓ [ 100% ] 10 VUs  1m0s

running (1m24.0s), 10/10 VUs, 10 complete and 0 interrupted iterations
default ↓ [ 100% ] 10 VUs  1m0s

running (1m25.0s), 10/10 VUs, 10 complete and 0 interrupted iterations
default ↓ [ 100% ] 10 VUs  1m0s

running (1m26.0s), 10/10 VUs, 10 complete and 0 interrupted iterations
default ↓ [ 100% ] 10 VUs  1m0s

running (1m27.0s), 10/10 VUs, 10 complete and 0 interrupted iterations
default ↓ [ 100% ] 10 VUs  1m0s

running (1m28.0s), 10/10 VUs, 10 complete and 0 interrupted iterations
default ↓ [ 100% ] 10 VUs  1m0s

running (1m29.0s), 10/10 VUs, 10 complete and 0 interrupted iterations
default ↓ [ 100% ] 10 VUs  1m0s

running (1m30.0s), 10/10 VUs, 10 complete and 0 interrupted iterations
default ↓ [ 100% ] 10 VUs  1m0s

running (1m31.0s), 10/10 VUs, 10 complete and 0 interrupted iterations
default ↓ [ 100% ] 10 VUs  1m0s


  █ THRESHOLDS 

    http_req_duration
    ✓ 'p(95)<2000' p(95)=108.82ms

    http_req_failed
    ✓ 'rate<0.05' rate=0.00%

    match_found
    ✓ 'rate>0.3' rate=0.00%

    spin_success
    ✓ 'rate>0.95' rate=100.00%


  █ TOTAL RESULTS 

    checks_total.......: 40      0.439291/s
    checks_succeeded...: 100.00% 40 out of 40
    checks_failed......: 0.00%   0 out of 40

    ✓ spin status is 200
    ✓ spin response time < 1s

    CUSTOM
    match_found....................: 0.00%   0 out of 0
    spin_success...................: 100.00% 20 out of 20
    spins_initiated................: 20      0.219645/s

    HTTP
    http_req_duration..............: avg=73.56ms min=46.18ms med=65.74ms max=968.39ms p(90)=89.04ms p(95)=108.82ms
      { expected_response:true }...: avg=73.56ms min=46.18ms med=65.74ms max=968.39ms p(90)=89.04ms p(95)=108.82ms
    http_req_failed................: 0.00%   0 out of 583
    http_reqs......................: 583     6.40266/s

    EXECUTION
    iteration_duration.............: avg=47.35s  min=45.53s  med=47.55s  max=49.83s   p(90)=48.32s  p(95)=49.07s  
    iterations.....................: 10      0.109823/s
    vus............................: 10      min=0        max=10
    vus_max........................: 10      min=10       max=10

    NETWORK
    data_received..................: 222 kB  2.4 kB/s
    data_sent......................: 81 kB   885 B/s




running (1m31.1s), 00/10 VUs, 10 complete and 10 interrupted iterations
default ✓ [ 100% ] 10 VUs  1m0s
